1410,100467102,10,4,67102,"Erstattung der Kosten für die Projekteinheit ""Nationale Vernetzungsstelle"" für den ländlichen Raum",2562971.39,"Erstattung der Kosten für die Projekteinheit ""Nationale Vernetzungsstelle"" für den ländlichen Raum",887386.95
1411,100489301,10,4,89301,Zuschüsse für Investitionen an die Bundesanstalt für Landwirtschaft und Ernährung (BLE),39700392.47,Zuschüsse für Investitionen an die Bundesanstalt für Landwirtschaft und Ernährung (BLE),4740953.11
1412,100454741,10,4,54741,Nicht aufteilbare sächliche Verwaltungsausgaben,4676.86,Nicht aufteilbare sächliche Verwaltungsausgaben,1971.95
1413,100467141,10,4,67141,Erstattung der Kosten für die zivile Notfallreserve und die Bundesreserve Getreide an die Bundesanstalt für Landwirtschaft und Ernährung (BLE),22937437.6,Erstattung der Kosten für die zivile Notfallreserve und die Bundesreserve Getreide an die Bundesanstalt für Landwirtschaft und Ernährung (BLE),17000000.0
1414,100568601,10,5,68601,Zuschüsse zur Förderung von Modell- und Demonstrationsvorhaben,1616301.23,Zuschüsse zur Förderung von Modell- und Demonstrationsvorhaben,5459187.63
1415,100568605,10,5,68605,Bundesprogramm Ländliche Entwicklung und regionale Wertschöpfung,33699249.7,Bundesprogramm Ländliche Entwicklung,3340233.02
1416,100568611,10,5,68611,"Zuschüsse zur Förderung von Forschungs-, Entwicklungs- und Demonstrationsvorhaben im Bereich der nachwachsenden Rohstoffe und zur Förderung der nationalen Projekte der nachhaltigen Waldwirtschaft",38717467.82,"Zuschüsse zur Förderung von Forschungs-, Entwicklungs- und Demonstrationsvorhaben im Bereich der nachwachsenden Rohstoffe und zur Förderung der nationalen Projekte der nachhaltigen Waldwirtschaft",27243089.14
1417,100589311,10,5,89311,"Zuschüsse zur Förderung von Forschungs-, Entwicklungs- und Demonstrationsvorhaben im Bereich der nachwachsenden Rohstoffe (Investitionen)",22883275.92,"Zuschüsse zur Förderung von Forschungs-, Entwicklungs- und Demonstrationsvorhaben im Bereich der nachwachsenden Rohstoffe (Investitionen)",20618885.54
1418,100563221,10,5,63221,Zweckgebundene Zuweisungen an die Länder für Mitgliedseinrichtungen der Wissenschaftsgemeinschaft Gottfried Wilhelm Leibniz e. V. (WGL),40786283.32,Zweckgebundene Zuweisungen an die Länder für Mitgliedseinrichtungen der Wissenschaftsgemeinschaft Gottfried Wilhelm Leibniz e. V. (WGL),32640291.76
1419,100568621,10,5,68621,Zuschuss an das Deutsche Biomasseforschungszentrum - Betrieb -,11036000.0,Zuschuss an das Deutsche Biomasseforschungszentrum - Betrieb -,6558000.0
1420,100588221,10,5,88221,Zweckgebundene Zuweisungen an die Länder für Mitgliedseinrichtungen der Wissenschaftsgemeinschaft Gottfried Wilhelm Leibniz e. V. (WGL),3390553.84,Zweckgebundene Zuweisungen an die Länder für Mitgliedseinrichtungen der Wissenschaftsgemeinschaft Gottfried Wilhelm Leibniz e. V. (WGL),3146900.0
1421,100589321,10,5,89321,Zuschuss an das Deutsche Biomasseforschungszentrum - Investitionen -,2269450.13,Zuschuss an das Deutsche Biomasseforschungszentrum - Investitionen -,3387000.0
1422,100554431,10,5,54431,"Forschung, Untersuchungen und Ähnliches",4777159.97,"Forschung, Untersuchungen und Ähnliches",3178377.61
1423,100568531,10,5,68531,"Zuschüsse für wissenschaftliche Veranstaltungen (Kongresse, Symposien u. Ä.) im Inland und zur Veröffentlichung wissenschaftlicher Forschungsergebnisse",96453.92,"Zuschüsse für wissenschaftliche Veranstaltungen (Kongresse, Symposien u. Ä.) im Inland und zur Veröffentlichung wissenschaftlicher Forschungsergebnisse",311508.21
1424,100568631,10,5,68631,"Förderung von Innovationen im Bereich Ernährung, Landwirtschaft und gesundheitlicher Verbraucherschutz",43211057.63,"Förderung von Innovationen im Bereich Ernährung, Landwirtschaft und gesundheitlicher Verbraucherschutz",21162628.5
1425,100568731,10,5,68731,"Internationale Forschungskooperationen zu Welternährung und zu anderen internat. Forschungsaufgaben auf dem Gebiet der Ernährung, der Landwirtschaft und des gesundheitlichen Verbraucherschutzes",7002296.41,"Internationale Forschungskooperationen zu Welternährung und zu anderen internat. Forschungsaufgaben auf dem Gebiet der Ernährung, der Landwirtschaft und des gesundheitlichen Verbraucherschutzes",3046068.74
1426,100589331,10,5,89331,"Förderung von Innovationen im Bereich Ernährung, Landwirtschaft und gesundheitlicher Verbraucherschutz",2017078.31,"Förderung von Innovationen im Bereich Ernährung, Landwirtschaft und gesundheitlicher Verbraucherschutz",4272498.8
1427,100668601,10,6,68601,Internationaler Praktikantenaustausch,200665.85,Internationaler Praktikantenaustausch,465351.19
1428,100668602,10,6,68602,Zuschüsse zur Ansiedlung internationaler Organisationen in Deutschland,540000.0,Zuschuss zur Umsiedlung des internationalen Fonds für Nutzpflanzenvielfalt (GCDT) und zur Ansiedlung des Sekretariats der Europäischen Waldkonvention,50000.0
1429,100668701,10,6,68701,Maßnahmen zur Verstärkung der Außenhandelsbeziehungen im Agrar- und Ernährungsbereich,2009483.52,Maßnahmen zur Verstärkung der Außenhandelsbeziehungen im Agrar- und Ernährungsbereich,2316591.25
1430,100668702,10,6,68702,"Bilaterale technische Zusammenarbeit mit dem Ausland auf dem Gebiet der Ernährung, der Landwirtschaft und des gesundheitlichen Verbraucherschutzes",20066547.32,"Bilaterale technische Zusammenarbeit mit dem Ausland auf dem Gebiet der Ernährung, der Landwirtschaft und des gesundheitlichen Verbraucherschutzes",12073241.8
1431,100668703,10,6,68703,"Beteiligung an Veranstaltungen der FAO und anderer internat. Organisationen auf dem Gebiet der Ernährung, der Landwirtschaft und des gesundheitlichen Verbraucherschutzes außerhalb Deutschlands",74155.86,"Beteiligung an Veranstaltungen der FAO und anderer internat. Organisationen auf dem Gebiet der Ernährung, der Landwirtschaft und des gesundheitlichen Verbraucherschutzes außerhalb Deutschlands",117414.26
1432,100668704,10,6,68704,Zusammenarbeit mit der FAO und anderen internationalen Organisationen im Agrar- und Ernährungsbereich,9613124.46,Zusammenarbeit mit der FAO und anderen internationalen Organisationen im Agrar- und Ernährungsbereich,10130528.67
1433,100668705,10,6,68705,Beiträge an nationale und internationale Organisationen,28698438.52,Beiträge an nationale und internationale Organisationen,32028526.1
1434,100668706,10,6,68706,Internationale nachhaltige Waldbewirtschaftung,5071829.38,Internationale nachhaltige Waldbewirtschaftung,3161165.09
1435,101011909,10,10,11909,Vermischte Einnahmen,11093630.91,Vermischte Einnahmen,2795678.19
1436,101012901,10,10,12901,"Ablieferung der Zinseinkünfte des Zweckvermögens, das von der Landwirtschaftlichen Rentenbank verwaltet wird",86219.11,"Ablieferung der Zinseinkünfte des Zweckvermögens, das von der Landwirtschaftlichen Rentenbank verwaltet wird",339236.64
1437,101015201,10,10,15201,Zinsen aus Darlehen zur Förderung der Flurbereinigung,2094.89,Zinsen aus Darlehen zur Förderung der Flurbereinigung,22409.53
1438,101016203,10,10,16203,Zinsen aus Darlehen für besondere agrarstrukturelle Maßnahmen,31013.35,Zinsen aus Darlehen für besondere agrarstrukturelle Maßnahmen,65870.69
1439,101017201,10,10,17201,Tilgung von Darlehen zur Förderung der Flurbereinigung,53952.76,Tilgung von Darlehen zur Förderung der Flurbereinigung,278644.42
1440,101018201,10,10,18201,"Tilgung von Mitteln, die von der Postbank verwaltet werden",19703.12,"Tilgung von Mitteln, die von der Postbank verwaltet werden",86368.22
1441,101018203,10,10,18203,Tilgung von Darlehen für besondere agrarstrukturelle Maßnahmen,331078.78,Tilgung von Darlehen für besondere agrarstrukturelle Maßnahmen,1088414.58
1442,101067101,10,10,67101,Vergütung an Banken für die Verwaltung von Bundesmitteln,43135.49,Vergütung an Banken für die Verwaltung von Bundesmitteln,556223.07
1443,101068304,10,10,68304,Maßnahmen zur Anpassung und Entwicklung der Fischereiflotte,1009934.4,Maßnahmen zur Anpassung der Kapazitäten in der Seefischerei,2368.0
1444,101068401,10,10,68401,Zuschüsse an Einrichtungen außerhalb der Bundesverwaltung - Betrieb -,19067972.11,Zuschüsse an Einrichtungen außerhalb der Bundesverwaltung - Betrieb -,15382265.96
1445,101068601,10,10,68601,Förderung von Wettbewerben und Vergabe von Ehrenpreisen,326348.43,Förderung von Wettbewerben und Vergabe von Ehrenpreisen,294889.16
1446,101068602,10,10,68602,"Zuschüsse für zentrale Informationsveranstaltungen, internationale Begegnungen und nichtwissenschaftliche internationale Tagungen",735778.06,"Zuschüsse für zentrale Informationsveranstaltungen, internationale Begegnungen und nichtwissenschaftliche internationale Tagungen",788371.1
1447,101083101,10,10,83101,Nachschüsse an die Deutsche Bauernsiedlung,297664.0,Nachschüsse an die Deutsche Bauernsiedlung,410044.5
1448,101089201,10,10,89201,Strukturmaßnahmen für die Seefischerei,26481.5,Strukturmaßnahmen für die Seefischerei,162109.0
1449,101089301,10,10,89301,Zuschüsse an Einrichtungen außerhalb der Bundesverwaltung - Zuschüsse für Investitionen -,242782.05,Zuschüsse an Einrichtungen außerhalb der Bundesverwaltung - Zuschüsse für Investitionen -,355143.11
1450,101128209,10,11,28209,"Einnahmen aus Sponsoring, Spenden und ähnlichen freiwilligen Geldleistungen",30350.0,"Einnahmen aus Sponsoring, Spenden und ähnlichen freiwilligen Geldleistungen",86442.44
1451,101123257,10,11,23257,Beteiligung an den Versorgungslasten des Bundes,165367.21,Beteiligung an den Versorgungslasten des Bundes,309784.54
1452,101152901,10,11,52901,Außergewöhnlicher Aufwand aus dienstlicher Veranlassung in besonderen Fällen,24511.04,Außergewöhnlicher Aufwand aus dienstlicher Veranlassung in besonderen Fällen,31653.6
1453,101154709,10,11,54709,"Ausgaben für Vorhaben, die aus Spenden, Sponsoring und ähnlichen freiwilligen Geldleistungen finanziert werden",28136.42,"Ausgaben für Vorhaben, die aus Spenden, Sponsoring und ähnlichen freiwilligen Geldleistungen finanziert werden",86277.63
1454,101198107,10,11,98107,Leistungen an Bundesbehörden zur Durchführung von ressortübergreifenden Aufgaben,314651.81,Leistungen an Bundesbehörden zur Durchführung von ressortübergreifenden Aufgaben,421422.69
1455,101143157,10,11,43157,"Versorgungsbezüge der Bundesministerin und Bundesminister, der Parlamentarischen Staatssekretäre und deren Hinterbliebenen",584700.22,"Versorgungsbezüge der Bundesministerin und Bundesminister, der Parlamentarischen Staatssekretäre und deren Hinterbliebenen",566906.74
1456,101143257,10,11,43257,Versorgungsbezüge,71239456.45,Versorgungsbezüge,52883959.74
1457,101143457,10,11,43457,Zuführung an die Versorgungsrücklage,3261398.0,Zuführung an die Versorgungsrücklage,2141150.3
1458,101144357,10,11,44357,Fürsorgeleistungen und Unterstützungen einschließlich Inanspruchnahme von besonderen Fachdiensten/-kräften,18946.13,Fürsorgeleistungen und Unterstützungen einschließlich Inanspruchnahme von besonderen Fachdiensten/-kräften,22465.76
1459,101144657,10,11,44657,Beihilfen aufgrund der Beihilfevorschriften,11737881.67,Beihilfen aufgrund der Beihilfevorschriften,7479488.74
1460,101163257,10,11,63257,Erstattungen des Bundes für Versorgungslasten,1078350.59,Erstattungen des Bundes für Versorgungslasten,1087264.63
1461,101142401,10,11,42401,Zuführung an die Versorgungsrücklage,2851157.56,Zuführung an die Versorgungsrücklage,1320302.62
1462,101144101,10,11,44101,Beihilfen aufgrund der Beihilfevorschriften,5205499.32,Beihilfen aufgrund der Beihilfevorschriften,3274172.05
1463,101144301,10,11,44301,Fürsorgeleistungen und Unterstützungen einschließlich Inanspruchnahme von besonderen Fachdiensten/-kräften,2258063.95,Fürsorgeleistungen und Unterstützungen einschließlich Inanspruchnahme von besonderen Fachdiensten/-kräften,1096246.17
1464,101145202,10,11,45202,Unfallversicherung Bund und Bahn,1404761.23,Unfallkasse des Bundes,1111091.95
1465,101152601,10,11,52601,Gerichts- und ähnliche Kosten,304893.46,Gerichts- und ähnliche Kosten,120755.64
1466,101152602,10,11,52602,"Sachverständige, Ausgaben für Mitglieder von Fachbeiräten und ähnlichen Ausschüssen",465079.71,"Sachverständige, Ausgaben für Mitglieder von Fachbeiräten und ähnlichen Ausschüssen",431464.08
1467,101152703,10,11,52703,Reisen in Angelegenheiten der Personalvertretungen und der Gleichstellungsbeauftragten sowie in Vertretung der Interessen schwerbehinderter Menschen,234261.01,Reisen in Angelegenheiten der Personalvertretungen und der Gleichstellungsbeauftragten sowie in Vertretung der Interessen schwerbehinderter Menschen,257552.03
1468,101154301,10,11,54301,Veröffentlichungen und Fachinformationen,1021355.72,Veröffentlichungen und Fachinformationen,521520.82
1469,101154501,10,11,54501,"Konferenzen, Tagungen, Messen und Ausstellungen",21734032.41,"Konferenzen, Tagungen, Messen und Ausstellungen",10975461.8
1470,101163403,10,11,63403,Zuweisungen an den Versorgungsfonds,25102948.91,Zuweisungen an den Versorgungsfonds,6730739.87
1471,101211909,10,12,11909,Vermischte Einnahmen,394375.1,Vermischte Einnahmen,17391.08
1472,101213201,10,12,13201,Erlöse aus der Veräußerung von beweglichen Sachen,185316.89,Erlöse aus der Veräußerung von beweglichen Sachen,183129.9
1473,101251802,10,12,51802,Mieten und Pachten im Zusammenhang mit dem Einheitlichen Liegenschaftsmanagement,14416334.0,Mieten und Pachten im Zusammenhang mit dem Einheitlichen Liegenschaftsmanagement,7372030.48
1474,101254201,10,12,54201,Öffentlichkeitsarbeit,609816.93,Öffentlichkeitsarbeit,1181870.21
1475,101242101,10,12,42101,Bezüge des Bundesministers und der Parlamentarischen Staatssekretärinnen,532850.66,Bezüge des Bundesministers und der Parlamentarischen Staatssekretärin und des Parlamentarischen Staatssekretärs,460469.91
1476,101242201,10,12,42201,Bezüge und Nebenleistungen der planmäßigen Beamtinnen und Beamten,59519509.76,Bezüge und Nebenleistungen der planmäßigen Beamtinnen und Beamten,36681239.73
1477,101242709,10,12,42709,"Entgelte für Arbeitskräfte mit befristeten Verträgen, sonstige Beschäftigungsentgelte (auch für Auszubildende) sowie Aufwendungen für nebenberuflich und nebenamtlich Tätige",6905808.68,"Entgelte für Arbeitskräfte mit befristeten Verträgen, sonstige Beschäftigungsentgelte (auch für Auszubildende) sowie Aufwendungen für nebenberuflich und nebenamtlich Tätige",2088560.65
1478,101242801,10,12,42801,Entgelte der Arbeitnehmerinnen und Arbeitnehmer,20584813.42,Entgelte der Arbeitnehmerinnen und Arbeitnehmer,16388655.33
1479,101245301,10,12,45301,"Trennungsgeld, Fahrtkostenzuschüsse sowie Umzugskostenvergütungen",655900.38,"Trennungsgeld, Fahrtkostenzuschüsse sowie Umzugskostenvergütungen",313392.54
1480,101251101,10,12,51101,"Geschäftsbedarf und Kommunikation sowie Geräte, Ausstattungs- und Ausrüstungsgegenstände, sonstige Gebrauchsgegenstände, Software, Wartung",3107694.94,"Geschäftsbedarf und Kommunikation sowie Geräte, Ausstattungs- und Ausrüstungsgegenstände, sonstige Gebrauchsgegenstände, Software, Wartung",2518389.4
1481,101251401,10,12,51401,"Verbrauchsmittel, Haltung von Fahrzeugen und dgl.",78053.8,"Verbrauchsmittel, Haltung von Fahrzeugen und dgl.",106964.84
1482,101251701,10,12,51701,"Bewirtschaftung der Grundstücke, Gebäude und Räume",7052991.81,"Bewirtschaftung der Grundstücke, Gebäude und Räume",4034225.27
1483,101251801,10,12,51801,Mieten und Pachten,214309.58,Mieten und Pachten,398584.15
1484,101251901,10,12,51901,Unterhaltung der Grundstücke und baulichen Anlagen,97538.05,Unterhaltung der Grundstücke und baulichen Anlagen,760808.73
1485,101252501,10,12,52501,Aus- und Fortbildung,346061.58,Aus- und Fortbildung,231523.8
1486,101252701,10,12,52701,Dienstreisen,2975197.71,Dienstreisen,2466255.86
1487,101253201,10,12,53201,Aufträge und Dienstleistungen im Bereich Informationstechnik,3184781.09,Aufträge und Dienstleistungen im Bereich Informationstechnik,1024139.08
1488,101253202,10,12,53202,Behördenspezifische fachbezogene Verwaltungsausgaben (ohne IT),8237531.11,Behördenspezifische fachbezogene Verwaltungsausgaben (ohne IT),7519775.31
1489,101253203,10,12,53203,Sonstige Dienstleistungsaufträge an Dritte,86735.93,Sonstige Dienstleistungsaufträge an Dritte,86119.11
1490,101253999,10,12,53999,Vermischte Verwaltungsausgaben,478016.01,Vermischte Verwaltungsausgaben,794987.88
1491,101281101,10,12,81101,Erwerb von Fahrzeugen,243977.62,Erwerb von Fahrzeugen,150340.42
1492,101281201,10,12,81201,"Erwerb von Geräten, Ausstattungs- und Ausrüstungsgegenständen für Verwaltungszwecke (ohne IT)",167138.17,"Erwerb von Geräten, Ausstattungs- und Ausrüstungsgegenständen für Verwaltungszwecke (ohne IT)",19518.73
1493,101281202,10,12,81202,"Erwerb von Anlagen, Geräten, Ausstattungs- und Ausrüstungsgegenständen sowie Software im Bereich Informationstechnik",5306790.37,"Erwerb von Anlagen, Geräten, Ausstattungs- und Ausrüstungsgegenständen sowie Software im Bereich Informationstechnik",890395.62
1494,101281206,10,12,81206,Beschaffung von Fernmeldegeräten,112498.6,Beschaffung von Fernmeldegeräten,53610.22
1495,101311101,10,13,11101,"Gebühren, sonstige Entgelte",80772.0,"Gebühren, sonstige Entgelte",72142.45
1496,101311901,10,13,11901,Einnahmen aus Veröffentlichungen,19649.88,Einnahmen aus Veröffentlichungen,24607.31
1497,101311909,10,13,11909,Vermischte Einnahmen,3972839.51,Vermischte Einnahmen,2396601.46
1498,101312501,10,13,12501,Einnahmen aus Versuchseinrichtungen,474702.21,Einnahmen aus Versuchseinrichtungen,328860.46
1499,101313201,10,13,13201,Erlöse aus der Veräußerung von beweglichen Sachen,51948.32,Erlöse aus der Veräußerung von beweglichen Sachen,83386.79
1500,101326101,10,13,26101,Erstattung von Verwaltungsausgaben,511453.93,Erstattung von Verwaltungsausgaben,244263.1
1501,101338101,10,13,38101,Leistungen von Bundesbehörden zur Durchführung von Aufträgen,3205135.43,Leistungen von Bundesbehörden zur Durchführung von Aufträgen,1849806.28
1502,101351802,10,13,51802,Mieten und Pachten im Zusammenhang mit dem Einheitlichen Liegenschaftsmanagement,18633831.87,Mieten und Pachten im Zusammenhang mit dem Einheitlichen Liegenschaftsmanagement,15242118.35
1503,101342729,10,13,42729,"Entgelte für Arbeitskräfte mit befristeten Verträgen, sonstige Beschäftigungsentgelte (auch für Auszubildende) sowie Aufwendungen für nebenberuflich und nebenamtlich Tätige",5992081.07,"Entgelte für Arbeitskräfte mit befristeten Verträgen, sonstige Beschäftigungsentgelte (auch für Auszubildende) sowie Aufwendungen für nebenberuflich und nebenamtlich Tätige",3362792.9
1504,101342821,10,13,42821,Entgelte der Arbeitnehmerinnen und Arbeitnehmer,84033.41,Entgelte der Arbeitnehmerinnen und Arbeitnehmer,116419.7
1505,101352721,10,13,52721,Dienstreisen,231114.76,Dienstreisen,153156.07
1506,101354721,10,13,54721,Nicht aufteilbare sächliche Verwaltungsausgaben,785964.56,Nicht aufteilbare sächliche Verwaltungsausgaben,1312904.93
1507,101381221,10,13,81221,"Erwerb von Geräten, Ausstattungs- und Ausrüstungsgegenständen für Verwaltungszwecke (ohne IT)",170603.34,"Erwerb von Geräten, Ausstattungs- und Ausrüstungsgegenständen für Verwaltungszwecke (ohne IT)",218686.1
1508,101342201,10,13,42201,Bezüge und Nebenleistungen der planmäßigen Beamtinnen und Beamten,12226646.83,Bezüge und Nebenleistungen der planmäßigen Beamtinnen und Beamten,10755629.82
1509,101342709,10,13,42709,"Entgelte für Arbeitskräfte mit befristeten Verträgen, sonstige Beschäftigungsentgelte (auch für Auszubildende) sowie Aufwendungen für nebenberuflich und nebenamtlich Tätige",5979618.81,"Entgelte für Arbeitskräfte mit befristeten Verträgen, sonstige Beschäftigungsentgelte (auch für Auszubildende) sowie Aufwendungen für nebenberuflich und nebenamtlich Tätige",3125818.18
1510,101342801,10,13,42801,Entgelte der Arbeitnehmerinnen und Arbeitnehmer,38712508.26,Entgelte der Arbeitnehmerinnen und Arbeitnehmer,33139184.92
1511,101345301,10,13,45301,"Trennungsgeld, Fahrtkostenzuschüsse sowie Umzugskostenvergütungen",14532.3,"Trennungsgeld, Fahrtkostenzuschüsse sowie Umzugskostenvergütungen",12347.35
1512,101351101,10,13,51101,"Geschäftsbedarf und Kommunikation sowie Geräte, Ausstattungs- und Ausrüstungsgegenstände, sonstige Gebrauchsgegenstände, Software, Wartung",2718171.36,"Geschäftsbedarf und Kommunikation sowie Geräte, Ausstattungs- und Ausrüstungsgegenstände, sonstige Gebrauchsgegenstände, Software, Wartung",1889184.73
1513,101351401,10,13,51401,"Verbrauchsmittel, Haltung von Fahrzeugen und dgl.",670902.63,"Verbrauchsmittel, Haltung von Fahrzeugen und dgl.",510570.01
1514,101351701,10,13,51701,"Bewirtschaftung der Grundstücke, Gebäude und Räume",9631786.73,"Bewirtschaftung der Grundstücke, Gebäude und Räume",8203772.0
1515,101351801,10,13,51801,Mieten und Pachten,1584876.72,Mieten und Pachten,1346275.66
1516,101351901,10,13,51901,Unterhaltung der Grundstücke und baulichen Anlagen,599175.8,Unterhaltung der Grundstücke und baulichen Anlagen,358634.36
1517,101352301,10,13,52301,Wissenschaftliche Sammlungen und Bibliotheken,71681.32,Wissenschaftliche Sammlungen und Bibliotheken,143686.49
1518,101352501,10,13,52501,Aus- und Fortbildung,213482.81,Aus- und Fortbildung,169107.57
1519,101352701,10,13,52701,Dienstreisen,627068.22,Dienstreisen,412965.29
1520,101353201,10,13,53201,Aufträge und Dienstleistungen im Bereich Informationstechnik,82305.46,Aufträge und Dienstleistungen im Bereich Informationstechnik,73235.73
1521,101353999,10,13,53999,Vermischte Verwaltungsausgaben,45108.52,Vermischte Verwaltungsausgaben,340072.49
1522,101354401,10,13,54401,"Forschung, Untersuchungen und Ähnliches",1948373.17,"Forschung, Untersuchungen und Ähnliches",1334275.17
1523,101368409,10,13,68409,"Mitgliedsbeiträge und sonstige Zuschüsse an Verbände, Vereine und ähnliche Institutionen geringeren Umfangs",7678.02,"Mitgliedsbeiträge und sonstige Zuschüsse an Verbände, Vereine und ähnliche Institutionen geringeren Umfangs",7702.34
1524,101368709,10,13,68709,Mitgliedsbeiträge und sonstige Zuschüsse für laufende Zwecke im Ausland geringeren Umfangs,15616.93,Mitgliedsbeiträge und sonstige Zuschüsse für laufende Zwecke im Ausland geringeren Umfangs,13643.93
1525,101371101,10,13,71101,"Kleine Neu-, Um- und Erweiterungsbauten",860113.48,"Kleine Neu-, Um- und Erweiterungsbauten",859111.81
1526,101381101,10,13,81101,Erwerb von Fahrzeugen,606158.05,Erwerb von Fahrzeugen,476949.34
1527,101381201,10,13,81201,"Erwerb von Geräten, Ausstattungs- und Ausrüstungsgegenständen für Verwaltungszwecke (ohne IT)",1805555.29,"Erwerb von Geräten, Ausstattungs- und Ausrüstungsgegenständen für Verwaltungszwecke (ohne IT)",1399183.27
1528,101381202,10,13,81202,"Erwerb von Anlagen, Geräten, Ausstattungs- und Ausrüstungsgegenständen sowie Software im Bereich Informationstechnik",1018229.17,"Erwerb von Anlagen, Geräten, Ausstattungs- und Ausrüstungsgegenständen sowie Software im Bereich Informationstechnik",647267.18
1529,101381205,10,13,81205,"Erwerb von Geräten, Ausstattungs- und Ausrüstungsgegenständen für Neu- und Erweiterungsbauten",39525.39,"Erwerb von Geräten, Ausstattungs- und Ausrüstungsgegenständen für Neu- und Erweiterungsbauten",76997.77
1530,101411101,10,14,11101,"Gebühren, sonstige Entgelte",170215.0,"Gebühren, sonstige Entgelte",155405.0
1531,101411909,10,14,11909,Vermischte Einnahmen,6546572.58,Vermischte Einnahmen,6942815.76
1532,101412401,10,14,12401,"Einnahmen aus Vermietung, Verpachtung und Nutzung",62493.03,"Einnahmen aus Vermietung, Verpachtung und Nutzung",73615.13
1533,101412501,10,14,12501,Einnahmen aus Versuchseinrichtungen,967342.65,Einnahmen aus Versuchseinrichtungen,963399.23
1534,101413201,10,14,13201,Erlöse aus der Veräußerung von beweglichen Sachen,128757.98,Erlöse aus der Veräußerung von beweglichen Sachen,295367.26
1535,101426101,10,14,26101,Erstattung von Verwaltungsausgaben,944710.7,Erstattung von Verwaltungsausgaben,540002.02
1536,101438101,10,14,38101,Leistungen von Bundesbehörden zur Durchführung von Aufträgen,1675797.85,Leistungen von Bundesbehörden zur Durchführung von Aufträgen,1151697.38
1537,101451802,10,14,51802,Mieten und Pachten im Zusammenhang mit dem Einheitlichen Liegenschaftsmanagement,37592326.32,Mieten und Pachten im Zusammenhang mit dem Einheitlichen Liegenschaftsmanagement,37254579.84
1538,101442729,10,14,42729,"Entgelte für Arbeitskräfte mit befristeten Verträgen, sonstige Beschäftigungsentgelte (auch für Auszubildende) sowie Aufwendungen für nebenberuflich und nebenamtlich Tätige",4748207.48,"Entgelte für Arbeitskräfte mit befristeten Verträgen, sonstige Beschäftigungsentgelte (auch für Auszubildende) sowie Aufwendungen für nebenberuflich und nebenamtlich Tätige",1888559.04
1539,101452721,10,14,52721,Dienstreisen,207290.5,Dienstreisen,210283.61
1540,101454721,10,14,54721,Nicht aufteilbare sächliche Verwaltungsausgaben,2495639.2,Nicht aufteilbare sächliche Verwaltungsausgaben,2151325.24
1541,101481221,10,14,81221,"Erwerb von Geräten, Ausstattungs- und Ausrüstungsgegenständen für Verwaltungszwecke (ohne IT)",179080.98,"Erwerb von Geräten, Ausstattungs- und Ausrüstungsgegenständen für Verwaltungszwecke (ohne IT)",121620.93
1542,101442201,10,14,42201,Bezüge und Nebenleistungen der planmäßigen Beamtinnen und Beamten,8788360.87,Bezüge und Nebenleistungen der planmäßigen Beamtinnen und Beamten,6099138.28
1543,101442709,10,14,42709,"Entgelte für Arbeitskräfte mit befristeten Verträgen, sonstige Beschäftigungsentgelte (auch für Auszubildende) sowie Aufwendungen für nebenberuflich und nebenamtlich Tätige",3861752.95,"Entgelte für Arbeitskräfte mit befristeten Verträgen, sonstige Beschäftigungsentgelte (auch für Auszubildende) sowie Aufwendungen für nebenberuflich und nebenamtlich Tätige",2790945.51
