1356,112010918,"Geldstrafen, Geldbußen und Gerichtskosten",1349842.46,"Geldstrafen, Geldbußen und Gerichtskosten",1189640.94
1357,119020918,Leistungen der Länder zur Durchführung von Aufträgen,629976.29,Leistungen der Länder zur Durchführung von Aufträgen,1220195.0
1358,119990918,Vermischte Einnahmen,202973.63,Vermischte Einnahmen,670894.84
1359,124010918,"Einnahmen aus Vermietung, Verpachtung und Nutzung",15212.0,"Einnahmen aus Vermietung, Verpachtung und Nutzung",45251.96
1360,132010918,Erlöse aus der Veräußerung von beweglichen Sachen,402907.93,Erlöse aus der Veräußerung von beweglichen Sachen,518297.81
1361,382010918,Einnahmen von Gebühren für die Energieregulierung im Auftrag der Länder und von Ausgleichsabgaben nach dem Postgesetz und von Abgaben zugunsten eines Vermittlungsdienstes für Hörgeschädigte,279757.46,Einnahmen von Gebühren für die Energieregulierung im Auftrag der Länder und von Ausgleichsabgaben nach dem Postgesetz und von Abgaben zugunsten eines Vermittlungsdienstes für Hörgeschädigte,1064781.37
1362,518020918,Mieten und Pachten im Zusammenhang mit dem Einheitlichen Liegenschaftsmanagement,17148617.75,Mieten und Pachten im Zusammenhang mit dem Einheitlichen Liegenschaftsmanagement,13653017.92
1363,687010918,Beiträge an internationale Organisationen,115126.53,Beiträge an internationale Organisationen,108252.0
1364,982010918,Erstattungen von Gebühren für die Energieregulierung an die Länder und Ausgleichsleistungen nach dem Postgesetz und Leistungen an einen Vermittlungsdienst für Hörgeschädigte,279709.41,Erstattungen von Gebühren für die Energieregulierung an die Länder und Ausgleichsleistungen nach dem Postgesetz und Leistungen an einen Vermittlungsdienst für Hörgeschädigte,1064736.28
1365,421010918,Bezüge der Präsidentin oder des Präsidenten und der Vizepräsidentinnen oder der Vizepräsidenten der Bundesnetzagentur,501087.32,Bezüge der Präsidentin oder des Präsidenten und der Vizepräsidentinnen oder der Vizepräsidenten der Bundesnetzagentur,430021.26
1366,422010918,Bezüge und Nebenleistungen der planmäßigen Beamtinnen und Beamten,133196539.92,Bezüge und Nebenleistungen der planmäßigen Beamtinnen und Beamten,107192458.53
1367,422030918,Bezüge der Anwärterinnen und Anwärter sowie Nebenleistungen der Beamtinnen und Beamten auf Widerruf im Vorbereitungsdienst,63272.86,Bezüge der Anwärterinnen und Anwärter sowie Nebenleistungen der Beamtinnen und Beamten auf Widerruf im Vorbereitungsdienst,110090.93
1368,427090918,"Entgelte für Arbeitskräfte mit befristeten Verträgen, sonstige Beschäftigungsentgelte (auch für Auszubildende) sowie Aufwendungen für nebenberuflich und nebenamtlich Tätige",3633872.44,"Entgelte für Arbeitskräfte mit befristeten Verträgen, sonstige Beschäftigungsentgelte (auch für Auszubildende) sowie Aufwendungen für nebenberuflich und nebenamtlich Tätige",2339232.63
1369,428010918,Entgelte der Arbeitnehmerinnen und Arbeitnehmer,34680018.99,Entgelte der Arbeitnehmerinnen und Arbeitnehmer,18294854.19
1370,453010918,"Trennungsgeld, Fahrtkostenzuschüsse sowie Umzugskostenvergütungen",515308.62,"Trennungsgeld, Fahrtkostenzuschüsse sowie Umzugskostenvergütungen",474475.51
1371,459990918,Vermischte Personalausgaben,1071543.08,Vermischte Personalausgaben,1100328.86
1372,511010918,"Geschäftsbedarf und Kommunikation sowie Geräte, Ausstattungs- und Ausrüstungsgegenstände, sonstige Gebrauchsgegenstände, Software, Wartung",13164633.96,"Geschäftsbedarf und Kommunikation sowie Geräte, Ausstattungs- und Ausrüstungsgegenstände, sonstige Gebrauchsgegenstände, Software, Wartung",10177124.41
1373,514010918,"Verbrauchsmittel, Haltung von Fahrzeugen und dgl.",763597.91,"Verbrauchsmittel, Haltung von Fahrzeugen und dgl.",752798.72
1374,517010918,"Bewirtschaftung der Grundstücke, Gebäude und Räume",9837957.04,"Bewirtschaftung der Grundstücke, Gebäude und Räume",7788676.31
1375,518010918,Mieten und Pachten,2810484.85,Mieten und Pachten,469330.33
1376,519010918,Unterhaltung der Grundstücke und baulichen Anlagen,575722.62,Unterhaltung der Grundstücke und baulichen Anlagen,340135.96
1377,525010918,Aus- und Fortbildung,862448.08,Aus- und Fortbildung,1411520.2
1378,527010918,Dienstreisen,2305535.25,Dienstreisen,3037959.01
1379,532010918,Aufträge und Dienstleistungen im Bereich Informationstechnik,9566387.71,Aufträge und Dienstleistungen im Bereich Informationstechnik,7420083.79
1380,539990918,Vermischte Verwaltungsausgaben,2637988.88,Vermischte Verwaltungsausgaben,1469988.85
1381,544010918,"Forschung, Untersuchungen und Ähnliches",5302621.18,"Forschung, Untersuchungen und Ähnliches",2290738.3
1382,711010918,"Kleine Neu-, Um- und Erweiterungsbauten",1327726.09,"Kleine Neu-, Um- und Erweiterungsbauten",7202.76
1383,811010918,Erwerb von Fahrzeugen,385172.33,Erwerb von Fahrzeugen,956860.84
1384,812020918,"Erwerb von Anlagen, Geräten, Ausstattungs- und Ausrüstungsgegenständen sowie Software im Bereich Informationstechnik",7136999.72,"Erwerb von Anlagen, Geräten, Ausstattungs- und Ausrüstungsgegenständen sowie Software im Bereich Informationstechnik",4396065.45
1385,812030918,"Erwerb von Geräten, Ausstattungs- und Ausrüstungsgegenständen für den technischen Bereich in der Telekommunikation sowie für Verwaltungszwecke",5106088.8,"Erwerb von Geräten, Ausstattungs- und Ausrüstungsgegenständen für den technischen Bereich in der Telekommunikation sowie für Verwaltungszwecke",3852401.97
1386,636011001,Zuschüsse zur Alterssicherung der Landwirte,2406144953.24,Zuschüsse zur Alterssicherung der Landwirte,2168524566.1
1387,636021001,Zuschüsse zur landwirtschaftlichen Unfallversicherung,99847566.79,Zuschüsse zur landwirtschaftlichen Unfallversicherung,100000000.0
1388,636031001,Zuschüsse zur Gewährung einer Rente an Kleinlandwirte bei Landabgabe (Landabgaberente),6479852.89,Zuschüsse zur Gewährung einer Rente an Kleinlandwirte bei Landabgabe (Landabgaberente),23311627.39
1389,636041001,Zuschüsse zur Krankenversicherung der Landwirte,1467666000.0,Zuschüsse zur Krankenversicherung der Landwirte,1371130000.0
1390,636051001,Zuschüsse zur Zusatzaltersversorgung für Arbeitnehmer in der Land- und Forstwirtschaft,30668998.24,Zuschüsse zur Zusatzaltersversorgung für Arbeitnehmer in der Land- und Forstwirtschaft,28489076.6
1391,636061001,Zuschüsse zur Förderung der Einstellung der landwirtschaftlichen Erwerbstätigkeit,501515.9,Zuschüsse zur Förderung der Einstellung der landwirtschaftlichen Erwerbstätigkeit,2069289.67
1392,671011002,Erstattung der Verwaltungskosten des Bundesinstituts für Risikobewertung,116489069.07,Erstattung der Verwaltungskosten des Bundesinstituts für Risikobewertung,69821533.19
1393,684041002,Information der Verbraucherinnen und Verbraucher sowie Maßnahmen zur Reduzierung der Lebensmittelverschwendung,6891217.02,Information der Verbraucherinnen und Verbraucher,11562188.23
1394,685011002,Zuschuss an die Deutsche Gesellschaft für Ernährung e. V.,5644270.0,Zuschuss an die Deutsche Gesellschaft für Ernährung e. V.,3505000.0
1395,893011002,Zuschüsse für Investitionen des Bundesinstituts für Risikobewertung,7089402.84,Zuschüsse für Investitionen des Bundesinstituts für Risikobewertung,6060183.27
1396,119091003,Vermischte Einnahmen,24034017.46,Vermischte Einnahmen,7252772.69
1397,172011003,Tilgung von Darlehen zur Förderung der Flurbereinigung,455609.77,Tilgung von Darlehen zur Förderung der Flurbereinigung,814879.5
1398,632901003,Bundesanteil zur Finanzierung der GAK (ohne Investitionen),157733126.05,"Bundesanteil zur Finanzierung der Gemeinschaftsaufgabe ""Verbesserung der Agrarstruktur und des Küstenschutzes"" (ohne Investitionen)",132282328.56
1399,882901003,Bundesanteil zur Finanzierung der GAK (Investitionen),324909151.05,"Bundesanteil zur Finanzierung der Gemeinschaftsaufgabe ""Verbesserung der Agrarstruktur und des Küstenschutzes"" (Investitionen)",384062392.72
1400,882911003,Bundesanteil zur Finanzierung des Sonderrahmenplanes für Maßnahmen des Küstenschutzes in Folge des Klimawandels,32275057.68,Bundesanteil zur Finanzierung des Sonderrahmenplanes für Maßnahmen des Küstenschutzes in Folge des Klimawandels,23299989.99
1401,882921003,Bundesanteil zur Finanzierung des Sonderrahmenplanes für Maßnahmen des präventiven Hochwasserschutzes,58891313.75,Bundesanteil zur Finanzierung des Sonderrahmenplanes für Maßnahmen des präventiven Hochwasserschutzes,18803000.0
1402,99021004,Einnahmen aus der Zusatzabgabe aufgrund der Milchgarantiemengen-Regelung,53692.96,Einnahmen aus der Zusatzabgabe aufgrund der Milchgarantiemengen-Regelung,8607.93
1403,119021004,"Einnahmen aus dem Verfall von Kautionsbeträgen, die nach dem EU-Marktordnungsrecht erhoben werden",265053.45,"Einnahmen aus dem Verfall von Kautionsbeträgen, die nach dem EU-Marktordnungsrecht erhoben werden",411910.4
1404,132011004,Erlöse aus der Veräußerung von beweglichen Sachen,5168931.34,Erlöse aus der Veräußerung von beweglichen Sachen,336800.69
1405,266011004,Erhebungskostenpauschale für die Wiedereinziehung zu Unrecht gezahlter Beträge des EGFL,654950.97,Erhebungskostenpauschale für die Wiedereinziehung zu Unrecht gezahlter Beträge des EGFL,1880.47
1406,272011004,Einnahmen aus Beteiligungen der EU-Strukturfonds,6887254.19,Einnahmen aus Beteiligungen der EU-Strukturfonds,225279.29
1407,272021004,Sonstige Einnahmen,6374885.0,Sonstige Einnahmen,1463345.75
1408,272041004,"Einnahmen aus Erstattungen der Europäischen Union für die Projekteinheit ""Nationale Vernetzungsstelle"" für den ländlichen Raum",417572.03,"Einnahmen aus Erstattungen der Europäischen Union für die Projekteinheit ""Nationale Vernetzungsstelle"" für den ländlichen Raum",157386.95
1409,671011004,Erstattung der Verwaltungskosten an die Bundesanstalt für Landwirtschaft und Ernährung (BLE),146715937.23,Erstattung der Verwaltungskosten an die Bundesanstalt für Landwirtschaft und Ernährung (BLE),85090631.45
1410,671021004,"Erstattung der Kosten für die Projekteinheit ""Nationale Vernetzungsstelle"" für den ländlichen Raum",2562971.39,"Erstattung der Kosten für die Projekteinheit ""Nationale Vernetzungsstelle"" für den ländlichen Raum",887386.95
1411,893011004,Zuschüsse für Investitionen an die Bundesanstalt für Landwirtschaft und Ernährung (BLE),39700392.47,Zuschüsse für Investitionen an die Bundesanstalt für Landwirtschaft und Ernährung (BLE),4740953.11
1412,547411004,Nicht aufteilbare sächliche Verwaltungsausgaben,4676.86,Nicht aufteilbare sächliche Verwaltungsausgaben,1971.95
1413,671411004,Erstattung der Kosten für die zivile Notfallreserve und die Bundesreserve Getreide an die Bundesanstalt für Landwirtschaft und Ernährung (BLE),22937437.6,Erstattung der Kosten für die zivile Notfallreserve und die Bundesreserve Getreide an die Bundesanstalt für Landwirtschaft und Ernährung (BLE),17000000.0
1414,686011005,Zuschüsse zur Förderung von Modell- und Demonstrationsvorhaben,1616301.23,Zuschüsse zur Förderung von Modell- und Demonstrationsvorhaben,5459187.63
1415,686051005,Bundesprogramm Ländliche Entwicklung und regionale Wertschöpfung,33699249.7,Bundesprogramm Ländliche Entwicklung,3340233.02
1416,686111005,"Zuschüsse zur Förderung von Forschungs-, Entwicklungs- und Demonstrationsvorhaben im Bereich der nachwachsenden Rohstoffe und zur Förderung der nationalen Projekte der nachhaltigen Waldwirtschaft",38717467.82,"Zuschüsse zur Förderung von Forschungs-, Entwicklungs- und Demonstrationsvorhaben im Bereich der nachwachsenden Rohstoffe und zur Förderung der nationalen Projekte der nachhaltigen Waldwirtschaft",27243089.14
1417,893111005,"Zuschüsse zur Förderung von Forschungs-, Entwicklungs- und Demonstrationsvorhaben im Bereich der nachwachsenden Rohstoffe (Investitionen)",22883275.92,"Zuschüsse zur Förderung von Forschungs-, Entwicklungs- und Demonstrationsvorhaben im Bereich der nachwachsenden Rohstoffe (Investitionen)",20618885.54
1418,632211005,Zweckgebundene Zuweisungen an die Länder für Mitgliedseinrichtungen der Wissenschaftsgemeinschaft Gottfried Wilhelm Leibniz e. V. (WGL),40786283.32,Zweckgebundene Zuweisungen an die Länder für Mitgliedseinrichtungen der Wissenschaftsgemeinschaft Gottfried Wilhelm Leibniz e. V. (WGL),32640291.76
1419,686211005,Zuschuss an das Deutsche Biomasseforschungszentrum - Betrieb -,11036000.0,Zuschuss an das Deutsche Biomasseforschungszentrum - Betrieb -,6558000.0
1420,882211005,Zweckgebundene Zuweisungen an die Länder für Mitgliedseinrichtungen der Wissenschaftsgemeinschaft Gottfried Wilhelm Leibniz e. V. (WGL),3390553.84,Zweckgebundene Zuweisungen an die Länder für Mitgliedseinrichtungen der Wissenschaftsgemeinschaft Gottfried Wilhelm Leibniz e. V. (WGL),3146900.0
1421,893211005,Zuschuss an das Deutsche Biomasseforschungszentrum - Investitionen -,2269450.13,Zuschuss an das Deutsche Biomasseforschungszentrum - Investitionen -,3387000.0
1422,544311005,"Forschung, Untersuchungen und Ähnliches",4777159.97,"Forschung, Untersuchungen und Ähnliches",3178377.61
1423,685311005,"Zuschüsse für wissenschaftliche Veranstaltungen (Kongresse, Symposien u. Ä.) im Inland und zur Veröffentlichung wissenschaftlicher Forschungsergebnisse",96453.92,"Zuschüsse für wissenschaftliche Veranstaltungen (Kongresse, Symposien u. Ä.) im Inland und zur Veröffentlichung wissenschaftlicher Forschungsergebnisse",311508.21
1424,686311005,"Förderung von Innovationen im Bereich Ernährung, Landwirtschaft und gesundheitlicher Verbraucherschutz",43211057.63,"Förderung von Innovationen im Bereich Ernährung, Landwirtschaft und gesundheitlicher Verbraucherschutz",21162628.5
1425,687311005,"Internationale Forschungskooperationen zu Welternährung und zu anderen internat. Forschungsaufgaben auf dem Gebiet der Ernährung, der Landwirtschaft und des gesundheitlichen Verbraucherschutzes",7002296.41,"Internationale Forschungskooperationen zu Welternährung und zu anderen internat. Forschungsaufgaben auf dem Gebiet der Ernährung, der Landwirtschaft und des gesundheitlichen Verbraucherschutzes",3046068.74
1426,893311005,"Förderung von Innovationen im Bereich Ernährung, Landwirtschaft und gesundheitlicher Verbraucherschutz",2017078.31,"Förderung von Innovationen im Bereich Ernährung, Landwirtschaft und gesundheitlicher Verbraucherschutz",4272498.8
1427,686011006,Internationaler Praktikantenaustausch,200665.85,Internationaler Praktikantenaustausch,465351.19
1428,686021006,Zuschüsse zur Ansiedlung internationaler Organisationen in Deutschland,540000.0,Zuschuss zur Umsiedlung des internationalen Fonds für Nutzpflanzenvielfalt (GCDT) und zur Ansiedlung des Sekretariats der Europäischen Waldkonvention,50000.0
1429,687011006,Maßnahmen zur Verstärkung der Außenhandelsbeziehungen im Agrar- und Ernährungsbereich,2009483.52,Maßnahmen zur Verstärkung der Außenhandelsbeziehungen im Agrar- und Ernährungsbereich,2316591.25
1430,687021006,"Bilaterale technische Zusammenarbeit mit dem Ausland auf dem Gebiet der Ernährung, der Landwirtschaft und des gesundheitlichen Verbraucherschutzes",20066547.32,"Bilaterale technische Zusammenarbeit mit dem Ausland auf dem Gebiet der Ernährung, der Landwirtschaft und des gesundheitlichen Verbraucherschutzes",12073241.8
1431,687031006,"Beteiligung an Veranstaltungen der FAO und anderer internat. Organisationen auf dem Gebiet der Ernährung, der Landwirtschaft und des gesundheitlichen Verbraucherschutzes außerhalb Deutschlands",74155.86,"Beteiligung an Veranstaltungen der FAO und anderer internat. Organisationen auf dem Gebiet der Ernährung, der Landwirtschaft und des gesundheitlichen Verbraucherschutzes außerhalb Deutschlands",117414.26
1432,687041006,Zusammenarbeit mit der FAO und anderen internationalen Organisationen im Agrar- und Ernährungsbereich,9613124.46,Zusammenarbeit mit der FAO und anderen internationalen Organisationen im Agrar- und Ernährungsbereich,10130528.67
1433,687051006,Beiträge an nationale und internationale Organisationen,28698438.52,Beiträge an nationale und internationale Organisationen,32028526.1
1434,687061006,Internationale nachhaltige Waldbewirtschaftung,5071829.38,Internationale nachhaltige Waldbewirtschaftung,3161165.09
1435,119091010,Vermischte Einnahmen,11093630.91,Vermischte Einnahmen,2795678.19
1436,129011010,"Ablieferung der Zinseinkünfte des Zweckvermögens, das von der Landwirtschaftlichen Rentenbank verwaltet wird",86219.11,"Ablieferung der Zinseinkünfte des Zweckvermögens, das von der Landwirtschaftlichen Rentenbank verwaltet wird",339236.64
1437,152011010,Zinsen aus Darlehen zur Förderung der Flurbereinigung,2094.89,Zinsen aus Darlehen zur Förderung der Flurbereinigung,22409.53
1438,162031010,Zinsen aus Darlehen für besondere agrarstrukturelle Maßnahmen,31013.35,Zinsen aus Darlehen für besondere agrarstrukturelle Maßnahmen,65870.69
1439,172011010,Tilgung von Darlehen zur Förderung der Flurbereinigung,53952.76,Tilgung von Darlehen zur Förderung der Flurbereinigung,278644.42
1440,182011010,"Tilgung von Mitteln, die von der Postbank verwaltet werden",19703.12,"Tilgung von Mitteln, die von der Postbank verwaltet werden",86368.22
1441,182031010,Tilgung von Darlehen für besondere agrarstrukturelle Maßnahmen,331078.78,Tilgung von Darlehen für besondere agrarstrukturelle Maßnahmen,1088414.58
1442,671011010,Vergütung an Banken für die Verwaltung von Bundesmitteln,43135.49,Vergütung an Banken für die Verwaltung von Bundesmitteln,556223.07
1443,683041010,Maßnahmen zur Anpassung und Entwicklung der Fischereiflotte,1009934.4,Maßnahmen zur Anpassung der Kapazitäten in der Seefischerei,2368.0
1444,684011010,Zuschüsse an Einrichtungen außerhalb der Bundesverwaltung - Betrieb -,19067972.11,Zuschüsse an Einrichtungen außerhalb der Bundesverwaltung - Betrieb -,15382265.96
1445,686011010,Förderung von Wettbewerben und Vergabe von Ehrenpreisen,326348.43,Förderung von Wettbewerben und Vergabe von Ehrenpreisen,294889.16
1446,686021010,"Zuschüsse für zentrale Informationsveranstaltungen, internationale Begegnungen und nichtwissenschaftliche internationale Tagungen",735778.06,"Zuschüsse für zentrale Informationsveranstaltungen, internationale Begegnungen und nichtwissenschaftliche internationale Tagungen",788371.1
1447,831011010,Nachschüsse an die Deutsche Bauernsiedlung,297664.0,Nachschüsse an die Deutsche Bauernsiedlung,410044.5
1448,892011010,Strukturmaßnahmen für die Seefischerei,26481.5,Strukturmaßnahmen für die Seefischerei,162109.0
1449,893011010,Zuschüsse an Einrichtungen außerhalb der Bundesverwaltung - Zuschüsse für Investitionen -,242782.05,Zuschüsse an Einrichtungen außerhalb der Bundesverwaltung - Zuschüsse für Investitionen -,355143.11
1450,282091011,"Einnahmen aus Sponsoring, Spenden und ähnlichen freiwilligen Geldleistungen",30350.0,"Einnahmen aus Sponsoring, Spenden und ähnlichen freiwilligen Geldleistungen",86442.44
1451,232571011,Beteiligung an den Versorgungslasten des Bundes,165367.21,Beteiligung an den Versorgungslasten des Bundes,309784.54
1452,529011011,Außergewöhnlicher Aufwand aus dienstlicher Veranlassung in besonderen Fällen,24511.04,Außergewöhnlicher Aufwand aus dienstlicher Veranlassung in besonderen Fällen,31653.6
1453,547091011,"Ausgaben für Vorhaben, die aus Spenden, Sponsoring und ähnlichen freiwilligen Geldleistungen finanziert werden",28136.42,"Ausgaben für Vorhaben, die aus Spenden, Sponsoring und ähnlichen freiwilligen Geldleistungen finanziert werden",86277.63
1454,981071011,Leistungen an Bundesbehörden zur Durchführung von ressortübergreifenden Aufgaben,314651.81,Leistungen an Bundesbehörden zur Durchführung von ressortübergreifenden Aufgaben,421422.69
1455,431571011,"Versorgungsbezüge der Bundesministerin und Bundesminister, der Parlamentarischen Staatssekretäre und deren Hinterbliebenen",584700.22,"Versorgungsbezüge der Bundesministerin und Bundesminister, der Parlamentarischen Staatssekretäre und deren Hinterbliebenen",566906.74
1456,432571011,Versorgungsbezüge,71239456.45,Versorgungsbezüge,52883959.74
1457,434571011,Zuführung an die Versorgungsrücklage,3261398.0,Zuführung an die Versorgungsrücklage,2141150.3
1458,443571011,Fürsorgeleistungen und Unterstützungen einschließlich Inanspruchnahme von besonderen Fachdiensten/-kräften,18946.13,Fürsorgeleistungen und Unterstützungen einschließlich Inanspruchnahme von besonderen Fachdiensten/-kräften,22465.76
1459,446571011,Beihilfen aufgrund der Beihilfevorschriften,11737881.67,Beihilfen aufgrund der Beihilfevorschriften,7479488.74
1460,632571011,Erstattungen des Bundes für Versorgungslasten,1078350.59,Erstattungen des Bundes für Versorgungslasten,1087264.63
1461,424011011,Zuführung an die Versorgungsrücklage,2851157.56,Zuführung an die Versorgungsrücklage,1320302.62
1462,441011011,Beihilfen aufgrund der Beihilfevorschriften,5205499.32,Beihilfen aufgrund der Beihilfevorschriften,3274172.05
1463,443011011,Fürsorgeleistungen und Unterstützungen einschließlich Inanspruchnahme von besonderen Fachdiensten/-kräften,2258063.95,Fürsorgeleistungen und Unterstützungen einschließlich Inanspruchnahme von besonderen Fachdiensten/-kräften,1096246.17
1464,452021011,Unfallversicherung Bund und Bahn,1404761.23,Unfallkasse des Bundes,1111091.95
1465,526011011,Gerichts- und ähnliche Kosten,304893.46,Gerichts- und ähnliche Kosten,120755.64
1466,526021011,"Sachverständige, Ausgaben für Mitglieder von Fachbeiräten und ähnlichen Ausschüssen",465079.71,"Sachverständige, Ausgaben für Mitglieder von Fachbeiräten und ähnlichen Ausschüssen",431464.08
1467,527031011,Reisen in Angelegenheiten der Personalvertretungen und der Gleichstellungsbeauftragten sowie in Vertretung der Interessen schwerbehinderter Menschen,234261.01,Reisen in Angelegenheiten der Personalvertretungen und der Gleichstellungsbeauftragten sowie in Vertretung der Interessen schwerbehinderter Menschen,257552.03
1468,543011011,Veröffentlichungen und Fachinformationen,1021355.72,Veröffentlichungen und Fachinformationen,521520.82
1469,545011011,"Konferenzen, Tagungen, Messen und Ausstellungen",21734032.41,"Konferenzen, Tagungen, Messen und Ausstellungen",10975461.8
1470,634031011,Zuweisungen an den Versorgungsfonds,25102948.91,Zuweisungen an den Versorgungsfonds,6730739.87
1471,119091012,Vermischte Einnahmen,394375.1,Vermischte Einnahmen,17391.08
1472,132011012,Erlöse aus der Veräußerung von beweglichen Sachen,185316.89,Erlöse aus der Veräußerung von beweglichen Sachen,183129.9
1473,518021012,Mieten und Pachten im Zusammenhang mit dem Einheitlichen Liegenschaftsmanagement,14416334.0,Mieten und Pachten im Zusammenhang mit dem Einheitlichen Liegenschaftsmanagement,7372030.48
1474,542011012,Öffentlichkeitsarbeit,609816.93,Öffentlichkeitsarbeit,1181870.21
1475,421011012,Bezüge des Bundesministers und der Parlamentarischen Staatssekretärinnen,532850.66,Bezüge des Bundesministers und der Parlamentarischen Staatssekretärin und des Parlamentarischen Staatssekretärs,460469.91
1476,422011012,Bezüge und Nebenleistungen der planmäßigen Beamtinnen und Beamten,59519509.76,Bezüge und Nebenleistungen der planmäßigen Beamtinnen und Beamten,36681239.73
1477,427091012,"Entgelte für Arbeitskräfte mit befristeten Verträgen, sonstige Beschäftigungsentgelte (auch für Auszubildende) sowie Aufwendungen für nebenberuflich und nebenamtlich Tätige",6905808.68,"Entgelte für Arbeitskräfte mit befristeten Verträgen, sonstige Beschäftigungsentgelte (auch für Auszubildende) sowie Aufwendungen für nebenberuflich und nebenamtlich Tätige",2088560.65
1478,428011012,Entgelte der Arbeitnehmerinnen und Arbeitnehmer,20584813.42,Entgelte der Arbeitnehmerinnen und Arbeitnehmer,16388655.33
1479,453011012,"Trennungsgeld, Fahrtkostenzuschüsse sowie Umzugskostenvergütungen",655900.38,"Trennungsgeld, Fahrtkostenzuschüsse sowie Umzugskostenvergütungen",313392.54
1480,511011012,"Geschäftsbedarf und Kommunikation sowie Geräte, Ausstattungs- und Ausrüstungsgegenstände, sonstige Gebrauchsgegenstände, Software, Wartung",3107694.94,"Geschäftsbedarf und Kommunikation sowie Geräte, Ausstattungs- und Ausrüstungsgegenstände, sonstige Gebrauchsgegenstände, Software, Wartung",2518389.4
1481,514011012,"Verbrauchsmittel, Haltung von Fahrzeugen und dgl.",78053.8,"Verbrauchsmittel, Haltung von Fahrzeugen und dgl.",106964.84
1482,517011012,"Bewirtschaftung der Grundstücke, Gebäude und Räume",7052991.81,"Bewirtschaftung der Grundstücke, Gebäude und Räume",4034225.27
1483,518011012,Mieten und Pachten,214309.58,Mieten und Pachten,398584.15
1484,519011012,Unterhaltung der Grundstücke und baulichen Anlagen,97538.05,Unterhaltung der Grundstücke und baulichen Anlagen,760808.73
1485,525011012,Aus- und Fortbildung,346061.58,Aus- und Fortbildung,231523.8
1486,527011012,Dienstreisen,2975197.71,Dienstreisen,2466255.86
1487,532011012,Aufträge und Dienstleistungen im Bereich Informationstechnik,3184781.09,Aufträge und Dienstleistungen im Bereich Informationstechnik,1024139.08
1488,532021012,Behördenspezifische fachbezogene Verwaltungsausgaben (ohne IT),8237531.11,Behördenspezifische fachbezogene Verwaltungsausgaben (ohne IT),7519775.31
1489,532031012,Sonstige Dienstleistungsaufträge an Dritte,86735.93,Sonstige Dienstleistungsaufträge an Dritte,86119.11
1490,539991012,Vermischte Verwaltungsausgaben,478016.01,Vermischte Verwaltungsausgaben,794987.88
1491,811011012,Erwerb von Fahrzeugen,243977.62,Erwerb von Fahrzeugen,150340.42
1492,812011012,"Erwerb von Geräten, Ausstattungs- und Ausrüstungsgegenständen für Verwaltungszwecke (ohne IT)",167138.17,"Erwerb von Geräten, Ausstattungs- und Ausrüstungsgegenständen für Verwaltungszwecke (ohne IT)",19518.73
