2385,152011103,Zinsen und Tilgung von Darlehen im Rahmen der Kriegsopferfürsorge und von entsprechenden Darlehen,169878.19,Zinsen und Tilgung von Darlehen im Rahmen der Kriegsopferfürsorge und von entsprechenden Darlehen,227940.33
2386,632011103,Badekuren in versorgungsfremden Kureinrichtungen,554275.76,Badekuren in versorgungsfremden Kureinrichtungen,535664.14
2387,636011103,Erstattungen an Krankenkassen nach §§ 19 und 20 des Bundesversorgungsgesetzes und an andere öffentlich-rechtliche Leistungsträger,21687013.71,Erstattungen an Krankenkassen nach §§ 19 und 20 des Bundesversorgungsgesetzes und an andere öffentlich-rechtliche Leistungsträger,29875513.45
2388,671011103,Durchführung der Versehrtenleibesübungen sowie Zuschüsse zur Förderung von Einrichtungen für Versehrtenleibesübungen für Kriegsbeschädigte,26264.53,Durchführung der Versehrtenleibesübungen sowie Zuschüsse zur Förderung von Einrichtungen für Versehrtenleibesübungen für Kriegsbeschädigte,39777.36
2389,685041103,Förderung des überregionalen Erfahrungsaustausches,228932.5,Förderung des überregionalen Erfahrungsaustausches,66056.1
2390,687011103,Versorgungsleistungen aufgrund inter- und supranationaler Verträge und Übereinkommen,184023.06,Versorgungsleistungen aufgrund inter- und supranationaler Verträge und Übereinkommen,228934.09
2391,852011103,Kriegsopferfürsorgedarlehen und gleichartige Darlehen,16418.01,Kriegsopferfürsorgedarlehen und gleichartige Darlehen,61036.54
2392,632111103,Fürsorgerische Leistungen für Berechtigte nach dem BVG,94930015.07,Fürsorgerische Leistungen für Berechtigte nach dem BVG,134338605.82
2393,636111103,Heil- und Krankenbehandlung für Berechtigte nach dem BVG,5329403.54,Heil- und Krankenbehandlung für Berechtigte nach dem BVG,6953601.83
2394,681111103,Versorgungsbezüge für Berechtigte nach dem BVG,159737686.38,Versorgungsbezüge für Berechtigte nach dem BVG,231600521.18
2395,632211103,Fürsorgerische Leistungen für Berechtigte nach dem OEG,16932444.13,Fürsorgerische Leistungen für Berechtigte nach dem OEG,14381474.26
2396,636211103,Heil- und Krankenbehandlung für Berechtigte nach dem OEG,32281165.99,Heil- und Krankenbehandlung für Berechtigte nach dem OEG,23512487.97
2397,681211103,Versorgungsbezüge für Berechtigte nach dem OEG,43976163.83,Versorgungsbezüge für Berechtigte nach dem OEG,44772079.16
2398,632311103,"Fürsorgerische Leistungen für Berechtigte nach dem HHG, dem StrRehaG und VwRehaG",706302.76,"Fürsorgerische Leistungen für Berechtigte nach dem HHG, dem StrRehaG und VwRehaG",1076533.97
2399,636311103,"Heil- und Krankenbehandlung für Berechtigte nach dem HHG, dem StrRehaG und VwRehaG",499436.82,"Heil- und Krankenbehandlung für Berechtigte nach dem HHG, dem StrRehaG und VwRehaG",393718.62
2400,681311103,"Versorgungsbezüge für Berechtigte nach dem HHG, dem StrRehaG und VwRehaG",11650839.76,"Versorgungsbezüge für Berechtigte nach dem HHG, dem StrRehaG und VwRehaG",11268491.64
2401,632411103,Fürsorgerische Leistungen für Berechtigte nach dem ZDG,130169.64,Fürsorgerische Leistungen für Berechtigte nach dem ZDG,112399.41
2402,636411103,Heil- und Krankenbehandlung für Berechtigte nach dem ZDG,47909.47,Heil- und Krankenbehandlung für Berechtigte nach dem ZDG,224531.81
2403,681411103,Versorgungsbezüge für Berechtigte nach dem ZDG,3271935.02,Versorgungsbezüge für Berechtigte nach dem ZDG,2783413.5
2404,636011104,Verwaltungskostenerstattung des Bundes an die Unfallversicherung Bund und Bahn,9647589.8,Verwaltungskostenerstattung des Bundes an die Unfallversicherung Bund und Bahn,2662384.05
2405,636021104,Verwaltungskostenerstattung des Bundes an die Künstlersozialkasse,15086782.06,Verwaltungskostenerstattung des Bundes an die Künstlersozialkasse,12668281.83
2406,636031104,Zuschuss des Bundes an die Künstlersozialkasse,257400000.0,Zuschuss des Bundes an die Künstlersozialkasse,251415573.3
2407,681011104,Fremdrenten in der Unfallversicherung,14400006.72,Fremdrenten in der Unfallversicherung,14959942.45
2408,681021104,Aufwendungen des Bundes für die gesetzliche Unfallversicherung,102184650.37,Aufwendungen des Bundes für die gesetzliche Unfallversicherung,98244048.55
2409,119991105,Vermischte Einnahmen,11981664.73,Vermischte Einnahmen,1393508.8
2410,162031105,Zinsen aus Darlehen zur Errichtung von überregionalen Zentren für die Rehabilitation Behinderter,11716.83,Zinsen aus Darlehen zur Errichtung von überregionalen Zentren für die Rehabilitation Behinderter,29421.59
2411,182031105,Tilgung von Darlehen zur Errichtung von überregionalen Zentren für die Rehabilitation Behinderter,239980.99,Tilgung von Darlehen zur Errichtung von überregionalen Zentren für die Rehabilitation Behinderter,641246.5
2412,232011105,Einnahmen aus der Ausgabe von Wertmarken für die Beförderung von Schwerbehinderten,14515283.45,Einnahmen aus der Ausgabe von Wertmarken für die Beförderung von Schwerbehinderten,12780493.04
2413,636011105,Kostenerstattung für die Bundesfachstelle Barrierefreiheit und Überwachungsstelle barrierefreie IT an die DRV Knappschaft-Bahn-See,4724108.83,Kostenerstattung für die Bundesfachstelle Barrierefreiheit und Überwachungsstelle barrierefreie IT an die DRV Knappschaft-Bahn-See,1552000.0
2414,682011105,Erstattung von Fahrgeldausfällen,219994199.2,Erstattung von Fahrgeldausfällen,241902056.9
2415,684031105,Zuschüsse zur Förderung der sozialen Eingliederung von Menschen mit Behinderungen,611200.0,Zuschüsse zur Förderung der sozialen Eingliederung von Menschen mit Behinderungen,578431.38
2416,684041105,Nationaler Aktionsplan zur Umsetzung der UN-Behindertenrechtskonvention,6186127.51,Nationaler Aktionsplan zur Behindertenpolitik und Teilhabebericht,4689595.3
2417,544111105,"Forschung, Untersuchungen und Ähnliches",1721694.18,"Forschung, Untersuchungen und Ähnliches",4986061.33
2418,636111105,Förderung von Modellvorhaben in den Rechtskreisen SGB II und SGB VI zur Stärkung der Rehabilitation,93500850.76,Förderung von Modellvorhaben in den Rechtskreisen SGB II und SGB VI zur Stärkung der Rehabilitation,52410596.03
2419,684171105,Ergänzende unabhängige Teilhabeberatung,48778231.36,Ergänzende unabhängige Teilhabeberatung,48466934.6
2420,686111105,Kostenerstattung für den Teilhabeverfahrensbericht an die Bundesarbeitsgemeinschaft Rehabilitation,1020923.72,Kostenerstattung für den Teilhabeverfahrensbericht an die Bundesarbeitsgemeinschaft Rehabilitation,791862.93
2421,119991106,Vermischte Einnahmen,104081.4,Vermischte Einnahmen,9504.15
2422,272021106,Einnahmen aus Zuschüssen des Europäischen Sozialfonds,542345480.5,Einnahmen aus Zuschüssen des Europäischen Sozialfonds,363631985.38
2423,272031106,Einnahmen aus Zuschüssen der Europäischen Union zu besonderen Maßnahmen,34231789.98,Einnahmen aus Zuschüssen der Europäischen Union zu besonderen Maßnahmen,24584483.66
2424,981031106,Verrechnungsausgaben gemäß § 61 BHO außerhalb der Tit. 981 .1 und 981 .7,882743.95,Verrechnungsausgaben gemäß § 61 BHO außerhalb der Tit. 981 .1 und 981 .7,2099951.04
2425,427191106,"Entgelte für Arbeitskräfte mit befristeten Verträgen, sonstige Beschäftigungsentgelte (auch für Auszubildende) sowie Aufwendungen für nebenberuflich und nebenamtlich Tätige",932551.13,"Entgelte für Arbeitskräfte mit befristeten Verträgen, sonstige Beschäftigungsentgelte (auch für Auszubildende) sowie Aufwendungen für nebenberuflich und nebenamtlich Tätige",1128463.66
2426,459191106,Vermischte Personalausgaben,1689901.71,Vermischte Personalausgaben,14414.51
2427,542111106,Öffentlichkeitsarbeit,370138.22,Öffentlichkeitsarbeit,55695.75
2428,544111106,"Forschung, Untersuchungen und Ähnliches",236610.42,"Forschung, Untersuchungen und Ähnliches",310222.25
2429,547111106,Nicht aufteilbare sächliche Verwaltungsausgaben,1604146.62,Nicht aufteilbare sächliche Verwaltungsausgaben,1659684.99
2430,686111106,Verwendung von Zuschüssen des Europäischen Sozialfonds zu laufenden Maßnahmen,253044685.11,Verwendung von Zuschüssen des Europäischen Sozialfonds zu laufenden Maßnahmen,139520824.81
2431,686131106,Kofinanzierung der ESF-Bundesprogramme,38659186.28,Kofinanzierung der ESF-Bundesprogramme,21199166.89
2432,686211106,Verwendung von Zuschüssen des Europäischen Fonds für die Anpassung an die Globalisierung,473186.48,Verwendung von Zuschüssen des Europäischen Fonds für die Anpassung an die Globalisierung,1575118.86
2433,686221106,"Kofinanzierung der Zuschüsse des Europäischen Fonds für die Anpassung an die Globalisierung (Globalisierungsfonds, EGF)",24159.23,"Kofinanzierung der Zuschüsse des Europäischen Fonds für die Anpassung an die Globalisierung (Globalisierungsfonds, EGF)",88000.0
2434,532341106,Kosten der internationalen Zusammenarbeit auf dem Gebiet der Arbeits- und Sozialpolitik,67530.33,Kosten der internationalen Zusammenarbeit auf dem Gebiet der Arbeits- und Sozialpolitik,116709.26
2435,684311106,Förderung der Arbeitnehmerfreizügigkeit der in Deutschland tätigen Arbeitskräfte aus der Europäischen Union,3792014.46,Förderung der Arbeitnehmerfreizügigkeit der in Deutschland tätigen Arbeitskräfte aus der Europäischen Union,3305873.15
2436,687311106,Beiträge an internationale Organisationen,23305596.96,Beiträge an internationale Organisationen,23879782.16
2437,427491106,"Entgelte für Arbeitskräfte mit befristeten Verträgen, sonstige Beschäftigungsentgelte (auch für Auszubildende) sowie Aufwendungen für nebenberuflich und nebenamtlich Tätige",154114.68,"Entgelte für Arbeitskräfte mit befristeten Verträgen, sonstige Beschäftigungsentgelte (auch für Auszubildende) sowie Aufwendungen für nebenberuflich und nebenamtlich Tätige",54000.93
2438,459491106,Vermischte Personalausgaben,106283.89,Vermischte Personalausgaben,267834.73
2439,547411106,Nicht aufteilbare sächliche Verwaltungsausgaben,11192.5,Nicht aufteilbare sächliche Verwaltungsausgaben,29407.3
2440,686411106,Verwendung von Zuschüssen des Europäischen Hilfsfonds für die am stärksten benachteiligten Personen zu laufenden Maßnahmen,1655078.15,Verwendung von Zuschüssen des Europäischen Hilfsfonds für die am stärksten benachteiligten Personen zu laufenden Maßnahmen,15451533.52
2441,119991107,Vermischte Einnahmen,254083.3,Vermischte Einnahmen,310112.75
2442,427091107,"Entgelte für Arbeitskräfte mit befristeten Verträgen, sonstige Beschäftigungsentgelte (auch für Auszubildende) sowie Aufwendungen für nebenberuflich und nebenamtlich Tätige",3295480.06,"Entgelte für Arbeitskräfte mit befristeten Verträgen, sonstige Beschäftigungsentgelte (auch für Auszubildende) sowie Aufwendungen für nebenberuflich und nebenamtlich Tätige",967699.28
2443,544061107,Fachkräfte-Offensive,808276.01,Fachkräfte-Offensive,1860.71
2444,545011107,"Konferenzen, Tagungen, Messen und Ausstellungen",2510817.41,"Konferenzen, Tagungen, Messen und Ausstellungen",3994847.93
2445,632011107,Zweckgebundene Zuweisungen an die Länder für Mitgliedseinrichtungen der Wissenschaftsgemeinschaft Gottfried Wilhelm Leibniz e. V. (WGL),7440000.0,Zweckgebundene Zuweisungen an die Länder für Mitgliedseinrichtungen der Wissenschaftsgemeinschaft Gottfried Wilhelm Leibniz e. V. (WGL),7180428.0
2446,684011107,"Initiative ""Neue Qualität der Arbeit""",2360503.95,"Initiative ""Neue Qualität der Arbeit""",1426304.17
2447,684021107,"Förderung innovativer Maßnahmen zur Gestaltung der Arbeitswelt im Wandel, zur Arbeitskräftesicherung und Weiterbildung",29936466.65,"Förderung innovativer Maßnahmen zur Gestaltung der Arbeitswelt im Wandel, zur Arbeitskräftesicherung und Weiterbildung",20207669.07
2448,684031107,Gestaltung des Wandels in Arbeitswelt und Sozialstaat,419317.87,Gestaltung des Wandels in Arbeitswelt und Sozialstaat,75522.46
2449,684041107,Arbeitsweltberichterstattung,1902664.88,Arbeitsweltberichterstattung,2297996.21
2450,684051107,Maßnahmen zur Förderung der Produktsicherheit und von Sicherheit und Gesundheit bei der Arbeit,2579706.42,Maßnahmen zur Förderung der Produktsicherheit und von Sicherheit und Gesundheit bei der Arbeit,378929.63
2451,684061107,Zuschüsse zu den Kosten der Kommission Arbeitsschutz und Normung in der EU,1552000.0,Zuschüsse zu den Kosten der Kommission Arbeitsschutz und Normung in der EU,1406127.45
2452,684071107,Gemeinsame Deutsche Arbeitsschutzstrategie - GDA -,68182.04,Gemeinsame Deutsche Arbeitsschutzstrategie - GDA -,205205.4
2453,684081107,Förderung von Maßnahmen zur Stärkung der gesellschaftlichen Verantwortung von Unternehmen (CSR-Maßnahmen),5328979.0,Förderung von Maßnahmen zur Stärkung der gesellschaftlichen Verantwortung von Unternehmen (CSR-Maßnahmen),4714272.13
2454,684111107,Denkfabrik Digitale Arbeitsgesellschaft,22580086.7,Denkfabrik Digitale Arbeitsgesellschaft,16616868.9
2455,882011107,Zweckgebundene Zuweisungen an die Länder für Mitgliedseinrichtungen der Wissenschaftsgemeinschaft Gottfried Wilhelm Leibniz e. V. (WGL),729000.0,Zweckgebundene Zuweisungen an die Länder für Mitgliedseinrichtungen der Wissenschaftsgemeinschaft Gottfried Wilhelm Leibniz e. V. (WGL),903480.0
2456,981031107,Verrechnungsausgaben gemäß § 61 BHO außerhalb der Tit. 981 .1 und 981 .7,333302.85,Verrechnungsausgaben gemäß § 61 BHO außerhalb der Tit. 981 .1 und 981 .7,132376.97
2457,119991110,Vermischte Einnahmen,5636697.76,Vermischte Einnahmen,40565.22
2458,632061110,Leistungen aufgrund rechtlicher Verpflichtungen des Bundes für Fürsorgezwecke,41875.79,Leistungen aufgrund rechtlicher Verpflichtungen des Bundes für Fürsorgezwecke,65974.6
2459,636011110,Kosten der Durchführung des Arbeitssicherstellungsgesetzes,300000.0,Kosten der Durchführung des Arbeitssicherstellungsgesetzes,346971.43
2460,684021110,"Zuwendungen für zentrale Einrichtungen, überregionale Maßnahmen und Modellvorhaben für besondere gesellschaftliche Gruppen",321025.76,"Zuwendungen für zentrale Einrichtungen, überregionale Maßnahmen und Modellvorhaben für besondere gesellschaftliche Gruppen",996289.82
2461,684031110,Leistungsanspruch der Sozialeinrichtungen in inländischen Häfen nach § 119 Abs. 4 SeeArbG,1500000.0,Leistungsanspruch der Sozialeinrichtungen in inländischen Häfen nach § 119 Abs. 4 SeeArbG,1499999.96
2462,684091110,"Mitgliedsbeiträge und sonstige Zuschüsse an Verbände, Vereine und ähnliche Institutionen geringeren Umfangs",24510.45,"Mitgliedsbeiträge und sonstige Zuschüsse an Verbände, Vereine und ähnliche Institutionen geringeren Umfangs",23985.58
2463,119571111,Vermischte Einnahmen,23810.29,Vermischte Einnahmen,18039.87
2464,232571111,Beteiligung an den Versorgungslasten des Bundes,28977.73,Beteiligung an den Versorgungslasten des Bundes,36831.12
2465,529011111,Außergewöhnlicher Aufwand aus dienstlicher Veranlassung in besonderen Fällen,51721.09,Außergewöhnlicher Aufwand aus dienstlicher Veranlassung in besonderen Fällen,11860.78
2466,542011111,Öffentlichkeitsarbeit,11641522.81,Öffentlichkeitsarbeit,7088146.58
2467,981031111,Verrechnungsausgaben gemäß § 61 BHO außerhalb der Tit. 981 .1 und 981 .7,209910.2,Verrechnungsausgaben gemäß § 61 BHO außerhalb der Tit. 981 .1 und 981 .7,171566.51
2468,981071111,Leistungen an Bundesbehörden zur Durchführung von ressortübergreifenden Aufgaben,27023771.49,Leistungen an Bundesbehörden zur Durchführung von ressortübergreifenden Aufgaben,28846347.77
2469,431571111,"Versorgungsbezüge der Bundesministerinnen und Bundesminister, Parlamentarischen Staatssekretärinnen und Staatssekretäre, sonstiger Amtsträger und deren Hinterbliebenen",535679.82,"Versorgungsbezüge der Bundesministerinnen und Bundesminister, Parlamentarischen Staatssekretärinnen und Staatssekretäre, sonstiger Amtsträger und deren Hinterbliebenen",545294.99
2470,432571111,Versorgungsbezüge,49439509.86,Versorgungsbezüge,45488360.98
2471,434571111,Zuführung an die Versorgungsrücklage,2317605.06,Zuführung an die Versorgungsrücklage,2106925.0
2472,443571111,Fürsorgeleistungen und Unterstützungen einschließlich Inanspruchnahme von besonderen Fachdiensten/-kräften,5099.3,Fürsorgeleistungen und Unterstützungen einschließlich Inanspruchnahme von besonderen Fachdiensten/-kräften,4808.0
2473,446571111,Beihilfen aufgrund der Beihilfevorschriften,5592931.05,Beihilfen aufgrund der Beihilfevorschriften,4564304.16
2474,632571111,Erstattungen des Bundes für Versorgungslasten,2895026.12,Erstattungen des Bundes für Versorgungslasten,2581954.85
2475,424011111,Zuführung an die Versorgungsrücklage,2801999.07,Zuführung an die Versorgungsrücklage,2290184.3
2476,441011111,Beihilfen aufgrund der Beihilfevorschriften,6144751.85,Beihilfen aufgrund der Beihilfevorschriften,4739750.81
2477,443011111,Fürsorgeleistungen und Unterstützungen einschließlich Inanspruchnahme von besonderen Fachdiensten/-kräften,1188304.3,Fürsorgeleistungen und Unterstützungen einschließlich Inanspruchnahme von besonderen Fachdiensten/-kräften,803040.69
2478,452021111,Unfallversicherung Bund und Bahn,149558.48,Unfallversicherung Bund und Bahn,180738.4
2479,526011111,Gerichts- und ähnliche Kosten,219680.77,Gerichts- und ähnliche Kosten,273674.14
2480,526021111,"Sachverständige, Ausgaben für Mitglieder von Fachbeiräten und ähnlichen Ausschüssen",913688.05,"Sachverständige, Ausgaben für Mitglieder von Fachbeiräten und ähnlichen Ausschüssen",682942.01
2481,527031111,Reisen in Angelegenheiten der Personalvertretungen und der Gleichstellungsbeauftragten sowie in Vertretung der Interessen schwerbehinderter Menschen,203305.09,Reisen in Angelegenheiten der Personalvertretungen und der Gleichstellungsbeauftragten sowie in Vertretung der Interessen schwerbehinderter Menschen,84386.19
2482,543011111,Veröffentlichungen und Fachinformationen,866267.73,Veröffentlichungen und Fachinformationen,802062.73
2483,545011111,"Konferenzen, Tagungen, Messen und Ausstellungen",569242.91,"Konferenzen, Tagungen, Messen und Ausstellungen",590081.81
2484,634031111,Zuweisungen an den Versorgungsfonds,24906395.92,Zuweisungen an den Versorgungsfonds,19577884.35
2485,132011112,Erlöse aus der Veräußerung von beweglichen Sachen,580502.75,Erlöse aus der Veräußerung von beweglichen Sachen,469601.32
2486,381031112,Verrechnungseinnahmen gemäß § 61 BHO außerhalb der Tit. 381 .1 und 381 .7,1037509.77,Verrechnungseinnahmen gemäß § 61 BHO außerhalb der Tit. 381 .1 und 381 .7,821593.34
2487,518021112,Mieten und Pachten im Zusammenhang mit dem Einheitlichen Liegenschaftsmanagement,20655883.48,Mieten und Pachten im Zusammenhang mit dem Einheitlichen Liegenschaftsmanagement,17172362.89
2488,981031112,Verrechnungsausgaben gemäß § 61 BHO außerhalb der Tit. 981 .1 und 981 .7,1386320.51,Verrechnungsausgaben gemäß § 61 BHO außerhalb der Tit. 981 .1 und 981 .7,297627.62
2489,412011112,Kosten der Tätigkeit der Bundeswahlbeauftragten oder des Bundeswahlbeauftragten für die Durchführung der Wahlen zu den Organen der Sozialversicherungsträger,91202.7,Kosten der Tätigkeit der Bundeswahlbeauftragten oder des Bundeswahlbeauftragten für die Durchführung der Wahlen zu den Organen der Sozialversicherungsträger,15671.24
2490,421011112,Bezüge des Bundesministers und der Parlamentarischen Staatssekretärinnen,532044.84,Bezüge der Bundesministerin und der Parlamentarischen Staatssekretäre,515212.71
2491,422011112,Bezüge und Nebenleistungen der planmäßigen Beamtinnen und Beamten,66083570.72,Bezüge und Nebenleistungen der planmäßigen Beamtinnen und Beamten,56901708.49
2492,422021112,Bezüge und Nebenleistungen der beamteten Hilfskräfte,1080148.08,Bezüge und Nebenleistungen der beamteten Hilfskräfte,1867723.45
2493,427091112,"Entgelte für Arbeitskräfte mit befristeten Verträgen, sonstige Beschäftigungsentgelte (auch für Auszubildende) sowie Aufwendungen für nebenberuflich und nebenamtlich Tätige",6599347.95,"Entgelte für Arbeitskräfte mit befristeten Verträgen, sonstige Beschäftigungsentgelte (auch für Auszubildende) sowie Aufwendungen für nebenberuflich und nebenamtlich Tätige",6855610.81
2494,428011112,Entgelte der Arbeitnehmerinnen und Arbeitnehmer,27562208.24,Entgelte der Arbeitnehmerinnen und Arbeitnehmer,22176135.74
2495,453011112,"Trennungsgeld, Fahrtkostenzuschüsse sowie Umzugskostenvergütungen",1067249.96,"Trennungsgeld, Fahrtkostenzuschüsse sowie Umzugskostenvergütungen",580594.16
2496,511011112,"Geschäftsbedarf und Kommunikation sowie Geräte, Ausstattungs- und Ausrüstungsgegenstände, sonstige Gebrauchsgegenstände, Software, Wartung",2633676.86,"Geschäftsbedarf und Kommunikation sowie Geräte, Ausstattungs- und Ausrüstungsgegenstände, sonstige Gebrauchsgegenstände, Software, Wartung",2905390.65
2497,514011112,"Verbrauchsmittel, Haltung von Fahrzeugen und dgl.",88008.7,"Verbrauchsmittel, Haltung von Fahrzeugen und dgl.",115456.49
2498,517011112,"Bewirtschaftung der Grundstücke, Gebäude und Räume",10943411.69,"Bewirtschaftung der Grundstücke, Gebäude und Räume",8441487.63
2499,518011112,Mieten und Pachten,578215.18,Mieten und Pachten,481272.7
2500,519011112,Unterhaltung der Grundstücke und baulichen Anlagen,50597.18,Unterhaltung der Grundstücke und baulichen Anlagen,112161.51
2501,525011112,Aus- und Fortbildung,1471182.3,Aus- und Fortbildung,1144019.13
2502,527011112,Dienstreisen,2031212.21,Dienstreisen,414492.99
2503,532011112,Aufträge und Dienstleistungen im Bereich Informationstechnik,5825947.74,Aufträge und Dienstleistungen im Bereich Informationstechnik,4240907.44
2504,539991112,Vermischte Verwaltungsausgaben,963787.18,Vermischte Verwaltungsausgaben,904002.33
2505,544011112,"Forschung, Untersuchungen und Ähnliches",13817501.98,"Forschung, Untersuchungen und Ähnliches",9683493.08
2506,711011112,"Kleine Neu-, Um- und Erweiterungsbauten",306983.11,"Kleine Neu-, Um- und Erweiterungsbauten",1007000.0
2507,811011112,Erwerb von Fahrzeugen,746817.56,Erwerb von Fahrzeugen,510976.19
2508,812011112,"Erwerb von Geräten, Ausstattungs- und Ausrüstungsgegenständen für Verwaltungszwecke (ohne IT)",1016420.45,"Erwerb von Geräten, Ausstattungs- und Ausrüstungsgegenständen für Verwaltungszwecke (ohne IT)",1069426.22
2509,812021112,"Erwerb von Anlagen, Geräten, Ausstattungs- und Ausrüstungsgegenständen sowie Software im Bereich Informationstechnik",3140648.01,"Erwerb von Anlagen, Geräten, Ausstattungs- und Ausrüstungsgegenständen sowie Software im Bereich Informationstechnik",6261778.28
2510,511111112,"Geschäftsbedarf und Kommunikation sowie Geräte, Ausstattungs- und Ausrüstungsgegenstände, sonstige Gebrauchsgegenstände, Software, Wartung",2234.15,"Geschäftsbedarf und Kommunikation sowie Geräte, Ausstattungs- und Ausrüstungsgegenstände, sonstige Gebrauchsgegenstände, Software, Wartung",2871.72
2511,514111112,"Verbrauchsmittel, Haltung von Fahrzeugen und dgl.",6156.75,"Verbrauchsmittel, Haltung von Fahrzeugen und dgl.",3325.87
2512,518111112,Mieten und Pachten,11238.94,Mieten und Pachten,5117.46
2513,527111112,Dienstreisen,69814.11,Dienstreisen,11902.61
2514,547111112,Nicht aufteilbare sächliche Verwaltungsausgaben,62762.1,Nicht aufteilbare sächliche Verwaltungsausgaben,63819.01
2515,111011113,"Gebühren, sonstige Entgelte",2872791.07,"Gebühren, sonstige Entgelte",2480560.58
2516,119991113,Vermischte Einnahmen,1627263.34,Vermischte Einnahmen,827128.01
2517,124011113,"Einnahmen aus Vermietung, Verpachtung und Nutzung",50888.3,"Einnahmen aus Vermietung, Verpachtung und Nutzung",8165.0
2518,132011113,Erlöse aus der Veräußerung von beweglichen Sachen,12510.68,Erlöse aus der Veräußerung von beweglichen Sachen,43363.9
2519,381011113,Leistungen von Bundesbehörden zur Durchführung von Aufträgen,397577.81,Leistungen von Bundesbehörden zur Durchführung von Aufträgen,774303.9
2520,518021113,Mieten und Pachten im Zusammenhang mit dem Einheitlichen Liegenschaftsmanagement,11817955.52,Mieten und Pachten im Zusammenhang mit dem Einheitlichen Liegenschaftsmanagement,11295800.64
2521,684021113,Verbesserung des Gefahrenschutzes im Haushalt,88449.06,Verbesserung des Gefahrenschutzes im Haushalt,89001.0
2522,686011113,"Beiträge an Verbände, Vereine, Gesellschaften, Organisationen und Einrichtungen",23106.81,"Beiträge an Verbände, Vereine, Gesellschaften, Organisationen und Einrichtungen",24197.61
2523,981011113,Leistungen an Bundesbehörden zur Durchführung von Aufträgen,107975.0,Leistungen an Bundesbehörden zur Durchführung von Aufträgen,98334.12
2524,422011113,Bezüge und Nebenleistungen der planmäßigen Beamtinnen und Beamten,10804198.66,Bezüge und Nebenleistungen der planmäßigen Beamtinnen und Beamten,10542021.58
2525,427091113,"Entgelte für Arbeitskräfte mit befristeten Verträgen, sonstige Beschäftigungsentgelte (auch für Auszubildende) sowie Aufwendungen für nebenberuflich und nebenamtlich Tätige",2282775.42,"Entgelte für Arbeitskräfte mit befristeten Verträgen, sonstige Beschäftigungsentgelte (auch für Auszubildende) sowie Aufwendungen für nebenberuflich und nebenamtlich Tätige",2294392.07
2526,428011113,Entgelte der Arbeitnehmerinnen und Arbeitnehmer,32256263.66,Entgelte der Arbeitnehmerinnen und Arbeitnehmer,29416585.94
2527,453011113,"Trennungsgeld, Fahrtkostenzuschüsse sowie Umzugskostenvergütungen",34389.59,"Trennungsgeld, Fahrtkostenzuschüsse sowie Umzugskostenvergütungen",46816.97
2528,511011113,"Geschäftsbedarf und Kommunikation sowie Geräte, Ausstattungs- und Ausrüstungsgegenstände, sonstige Gebrauchsgegenstände, Software, Wartung",1807066.21,"Geschäftsbedarf und Kommunikation sowie Geräte, Ausstattungs- und Ausrüstungsgegenstände, sonstige Gebrauchsgegenstände, Software, Wartung",1612003.83
2529,517011113,"Bewirtschaftung der Grundstücke, Gebäude und Räume",4488215.22,"Bewirtschaftung der Grundstücke, Gebäude und Räume",3447550.55
2530,519011113,Unterhaltung der Grundstücke und baulichen Anlagen,123242.97,Unterhaltung der Grundstücke und baulichen Anlagen,217723.97
