,id,Zweckbestimmung,Ist 2023,2021 Zweck,Ist 2021
0,232010101,Beteiligung der Länder an der Deutschen Künstlerhilfe und sonstige ihr zugedachte Einnahmen,1085500.0,Beteiligung der Länder an der Deutschen Künstlerhilfe und sonstige ihr zugedachte Einnahmen,1104400.0
1,529010101,Außergewöhnlicher Aufwand aus dienstlicher Veranlassung in besonderen Fällen,1070598.98,Außergewöhnlicher Aufwand aus dienstlicher Veranlassung in besonderen Fällen,804600.33
2,681010101,"Übernahme von Patenschaften, Ausgaben aus besonderer Veranlassung und besondere Bewilligungen.",1341480.99,"Übernahme von Patenschaften, Ausgaben aus besonderer Veranlassung und besondere Bewilligungen.",1159120.94
3,684010101,Deutsche Künstlerhilfe,3123801.79,Deutsche Künstlerhilfe,3404400.0
4,421010101,Bezüge des Bundespräsidenten,259498.56,Bezüge des Bundespräsidenten,254916.72
5,421020101,Aufwandsgeld,78000.0,Aufwandsgeld,78000.0
6,232570111,Beteiligung an den Versorgungslasten des Bundes,107670.44,Beteiligung an den Versorgungslasten des Bundes,286007.88
7,542010111,Öffentlichkeitsarbeit,318412.31,Öffentlichkeitsarbeit,321062.98
8,981030111,Verrechnungsausgaben gemäß § 61 BHO außerhalb der Tit. 981 .1 und 981 .7,35000.0,Verrechnungsausgaben gemäß § 61 BHO außerhalb der Tit. 981 .1 und 981 .7,28000.0
9,431570111,Versorgungsbezüge der Bundespräsidenten und deren Hinterbliebenen,826115.29,Versorgungsbezüge der Bundespräsidenten und deren Hinterbliebenen,929587.17
10,432570111,Versorgungsbezüge,3364817.39,Versorgungsbezüge,3318787.36
11,434570111,Zuführung an die Versorgungsrücklage,186772.13,Zuführung an die Versorgungsrücklage,187468.77
12,446570111,Beihilfen aufgrund der Beihilfevorschriften,927317.55,Beihilfen aufgrund der Beihilfevorschriften,938175.8
13,424010111,Zuführung an die Versorgungsrücklage,144448.26,Zuführung an die Versorgungsrücklage,141530.55
14,441010111,Beihilfen aufgrund der Beihilfevorschriften,350288.67,Beihilfen aufgrund der Beihilfevorschriften,290068.15
15,443010111,Fürsorgeleistungen und Unterstützungen einschließlich Inanspruchnahme von besonderen Fachdiensten/-kräften,73873.2,Fürsorgeleistungen und Unterstützungen einschließlich Inanspruchnahme von besonderen Fachdiensten/-kräften,85186.61
16,452020111,Unfallversicherung Bund und Bahn,13098.52,Unfallversicherung Bund und Bahn,6056.08
17,526010111,Gerichts- und ähnliche Kosten,26957.17,Gerichts- und ähnliche Kosten,21358.09
18,526020111,"Sachverständige, Ausgaben für Mitglieder von Fachbeiräten und ähnlichen Ausschüssen",31283.03,"Sachverständige, Ausgaben für Mitglieder von Fachbeiräten und ähnlichen Ausschüssen",11335.55
19,545010111,"Konferenzen, Tagungen, Messen und Ausstellungen",2402010.01,"Konferenzen, Tagungen, Messen und Ausstellungen",1935081.98
20,634030111,Zuweisungen an den Versorgungsfonds,855563.01,Zuweisungen an den Versorgungsfonds,638316.86
21,119990112,Vermischte Einnahmen,4250.0,Vermischte Einnahmen,109757.46
22,422010112,Bezüge und Nebenleistungen der planmäßigen Beamtinnen und Beamten,6859904.27,Bezüge und Nebenleistungen der planmäßigen Beamtinnen und Beamten,6163360.84
23,427090112,"Entgelte für Arbeitskräfte mit befristeten Verträgen, sonstige Beschäftigungsentgelte (auch für Auszubildende) sowie Aufwendungen für nebenberuflich und nebenamtlich Tätige",1106216.05,"Entgelte für Arbeitskräfte mit befristeten Verträgen, sonstige Beschäftigungsentgelte (auch für Auszubildende) sowie Aufwendungen für nebenberuflich und nebenamtlich Tätige",1400507.75
24,428010112,Entgelte der Arbeitnehmerinnen und Arbeitnehmer,10552513.6,Entgelte der Arbeitnehmerinnen und Arbeitnehmer,8911208.87
25,453010112,"Trennungsgeld, Fahrtkostenzuschüsse sowie Umzugskostenvergütungen",28377.68,"Trennungsgeld, Fahrtkostenzuschüsse sowie Umzugskostenvergütungen",8039.28
26,511010112,"Geschäftsbedarf und Kommunikation sowie Geräte, Ausstattungs- und Ausrüstungsgegenstände, sonstige Gebrauchsgegenstände, Software, Wartung",1195006.4,"Geschäftsbedarf und Kommunikation sowie Geräte, Ausstattungs- und Ausrüstungsgegenstände, sonstige Gebrauchsgegenstände, Software, Wartung",1168244.33
27,514010112,"Verbrauchsmittel, Haltung von Fahrzeugen und dgl.",179118.66,"Verbrauchsmittel, Haltung von Fahrzeugen und dgl.",126548.27
28,517010112,"Bewirtschaftung der Grundstücke, Gebäude und Räume",2952352.9,"Bewirtschaftung der Grundstücke, Gebäude und Räume",2456920.86
29,518010112,Mieten und Pachten,299733.95,Mieten und Pachten,320082.82
30,519010112,Unterhaltung der Grundstücke und baulichen Anlagen,1417980.82,Unterhaltung der Grundstücke und baulichen Anlagen,1495679.11
31,525010112,Aus- und Fortbildung,119293.12,Aus- und Fortbildung,21964.11
32,527010112,Dienstreisen,257615.55,Dienstreisen,99283.66
33,532010112,Aufträge und Dienstleistungen im Bereich Informationstechnik,741562.58,Aufträge und Dienstleistungen im Bereich Informationstechnik,540999.37
34,532040112,Kosten aus Anlass von Staatsbesuchen und Reisen des Bundespräsidenten im Ausland,1758449.35,Kosten aus Anlass von Staatsbesuchen und Reisen des Bundespräsidenten im Ausland,791005.25
35,532050112,Kosten für Orden und Ehrenzeichen,205950.22,Kosten für Orden und Ehrenzeichen,60838.13
36,539990112,Vermischte Verwaltungsausgaben,96445.28,Vermischte Verwaltungsausgaben,130840.07
37,711010112,"Kleine Neu-, Um- und Erweiterungsbauten",446028.96,"Kleine Neu-, Um- und Erweiterungsbauten",456299.0
38,812010112,"Erwerb von Geräten, Ausstattungs- und Ausrüstungsgegenständen für Verwaltungszwecke (ohne IT)",118992.97,"Erwerb von Geräten, Ausstattungs- und Ausrüstungsgegenständen für Verwaltungszwecke (ohne IT)",94650.99
39,812020112,"Erwerb von Anlagen, Geräten, Ausstattungs- und Ausrüstungsgegenständen sowie Software im Bereich Informationstechnik",496552.21,"Erwerb von Anlagen, Geräten, Ausstattungs- und Ausrüstungsgegenständen sowie Software im Bereich Informationstechnik",465402.91
40,422010113,Bezüge und Nebenleistungen der planmäßigen Beamtinnen und Beamten,514032.92,Bezüge und Nebenleistungen der planmäßigen Beamtinnen und Beamten,435363.54
41,427090113,"Entgelte für Arbeitskräfte mit befristeten Verträgen, sonstige Beschäftigungsentgelte (auch für Auszubildende) sowie Aufwendungen für nebenberuflich und nebenamtlich Tätige",7674.24,"Entgelte für Arbeitskräfte mit befristeten Verträgen, sonstige Beschäftigungsentgelte (auch für Auszubildende) sowie Aufwendungen für nebenberuflich und nebenamtlich Tätige",48749.21
42,428010113,Entgelte der Arbeitnehmerinnen und Arbeitnehmer,1271379.84,Entgelte der Arbeitnehmerinnen und Arbeitnehmer,1036153.91
43,441010113,Beihilfen aufgrund der Beihilfevorschriften,18698.57,Beihilfen aufgrund der Beihilfevorschriften,20510.9
44,443010113,Fürsorgeleistungen und Unterstützungen einschließlich Inanspruchnahme von besonderen Fachdiensten/-kräften,1237.13,Fürsorgeleistungen und Unterstützungen einschließlich Inanspruchnahme von besonderen Fachdiensten/-kräften,1575.14
45,511010113,"Geschäftsbedarf und Kommunikation sowie Geräte, Ausstattungs- und Ausrüstungsgegenstände, sonstige Gebrauchsgegenstände, Software, Wartung",86360.42,"Geschäftsbedarf und Kommunikation sowie Geräte, Ausstattungs- und Ausrüstungsgegenstände, sonstige Gebrauchsgegenstände, Software, Wartung",76236.13
46,518010113,Mieten und Pachten,11654.8,Mieten und Pachten,303932.19
47,532010113,Aufträge und Dienstleistungen im Bereich Informationstechnik,19836.26,Aufträge und Dienstleistungen im Bereich Informationstechnik,66446.25
48,539990113,Vermischte Verwaltungsausgaben,218645.78,Vermischte Verwaltungsausgaben,120392.86
49,634030113,Zuweisungen an den Versorgungsfonds,105383.36,Zuweisungen an den Versorgungsfonds,73892.82
50,811010113,Erwerb von Fahrzeugen,22000.0,Erwerb von Fahrzeugen,16291.07
51,812020113,"Erwerb von Anlagen, Geräten, Ausstattungs- und Ausrüstungsgegenständen sowie Software im Bereich Informationstechnik",196183.43,"Erwerb von Anlagen, Geräten, Ausstattungs- und Ausrüstungsgegenständen sowie Software im Bereich Informationstechnik",49779.52
52,232570211,Beteiligung an den Versorgungslasten des Bundes,34318.83,Beteiligung an den Versorgungslasten des Bundes,18800.0
53,529010211,Außergewöhnlicher Aufwand aus dienstlicher Veranlassung in besonderen Fällen,227017.21,Außergewöhnlicher Aufwand aus dienstlicher Veranlassung in besonderen Fällen,228752.18
54,542010211,Öffentlichkeitsarbeit,2192458.46,Öffentlichkeitsarbeit,6417893.4
55,431570211,Versorgungsbezüge sonstiger Amtsträger und deren Hinterbliebenen,259433.61,Versorgungsbezüge sonstiger Amtsträger und deren Hinterbliebenen,338236.74
56,432570211,Versorgungsbezüge,29702599.71,Versorgungsbezüge,27671367.89
57,434570211,Zuführung an die Versorgungsrücklage,1360454.65,Zuführung an die Versorgungsrücklage,1211126.39
58,443570211,Fürsorgeleistungen und Unterstützungen einschließlich Inanspruchnahme von besonderen Fachdiensten/-kräften,2010.0,Fürsorgeleistungen und Unterstützungen einschließlich Inanspruchnahme von besonderen Fachdiensten/-kräften,1979.93
59,446570211,Beihilfen aufgrund der Beihilfevorschriften,6201107.3,Beihilfen aufgrund der Beihilfevorschriften,4806554.81
60,632570211,Erstattungen des Bundes für Versorgungslasten,287274.01,Erstattungen des Bundes für Versorgungslasten,1327675.53
61,424010211,Zuführung an die Versorgungsrücklage,1962284.96,Zuführung an die Versorgungsrücklage,1753611.91
62,441010211,Beihilfen aufgrund der Beihilfevorschriften,4051899.92,Beihilfen aufgrund der Beihilfevorschriften,3078906.5
63,443010211,Fürsorgeleistungen und Unterstützungen einschließlich Inanspruchnahme von besonderen Fachdiensten/-kräften,129984.95,Fürsorgeleistungen und Unterstützungen einschließlich Inanspruchnahme von besonderen Fachdiensten/-kräften,211484.95
64,452020211,Unfallversicherung Bund und Bahn,321231.95,Unfallversicherung Bund und Bahn,431614.45
65,526010211,Gerichts- und ähnliche Kosten,263329.72,Gerichts- und ähnliche Kosten,326143.16
66,526020211,"Sachverständige, Ausgaben für Mitglieder von Fachbeiräten und ähnlichen Ausschüssen",1991256.33,"Sachverständige, Ausgaben für Mitglieder von Fachbeiräten und ähnlichen Ausschüssen",1630471.93
67,634030211,Zuweisungen an den Versorgungsfonds,11748328.47,Zuweisungen an den Versorgungsfonds,11082824.07
68,111010212,"Gebühren, sonstige Entgelte",414151.45,"Gebühren, sonstige Entgelte",354475.5
69,119010212,Einnahmen aus Veröffentlichungen,178975.6,Einnahmen aus Veröffentlichungen,184530.36
70,119990212,Vermischte Einnahmen,147042.97,Vermischte Einnahmen,205632.69
71,124010212,"Einnahmen aus Vermietung, Verpachtung und Nutzung",993499.74,"Einnahmen aus Vermietung, Verpachtung und Nutzung",632858.59
72,132010212,Erlöse aus der Veräußerung von beweglichen Sachen,265244.77,Erlöse aus der Veräußerung von beweglichen Sachen,287267.7
73,411010212,Entschädigungen und Amtszulagen nach § 11 Abgeordnetengesetz,89070847.41,Entschädigungen und Amtszulagen nach § 11 Abgeordnetengesetz,83655752.91
74,411020212,Aufwandsentschädigungen nach § 12 Abs. 2 und 5 Abgeordnetengesetz,40687391.97,Aufwandsentschädigungen nach § 12 Abs. 2 und 5 Abgeordnetengesetz,40094515.7
75,411030212,Aufwendungen für die Beschäftigung von Mitarbeitern nach § 12 Abs. 3 Abgeordnetengesetz,263448991.46,Aufwendungen für die Beschäftigung von Mitarbeitern nach § 12 Abs. 3 Abgeordnetengesetz,230880478.66
76,411040212,"Zuschuss zu den Kosten in Krankheits-, Pflege- und Geburtsfällen sowie Unterstützungen nach §§ 27 und 28 Abgeordnetengesetz",10232683.33,"Zuschuss zu den Kosten in Krankheits-, Pflege- und Geburtsfällen sowie Unterstützungen nach §§ 27 und 28 Abgeordnetengesetz",9896490.63
77,411050212,Übergangsgeld für ausgeschiedene Mitglieder des Deutschen Bundestages nach § 18  Abgeordnetengesetz,1512722.21,Übergangsgeld für ausgeschiedene Mitglieder des Deutschen Bundestages nach § 18  Abgeordnetengesetz,4401371.47
78,411110212,"Überbrückungsgeld/Sterbegeld an Hinterbliebene sowie Versicherungen nach §§ 24, 26, 35a, 35b, 37, 38 und 41 Abgeordnetengesetz",217332.29,"Überbrückungsgeld/Sterbegeld an Hinterbliebene sowie Versicherungen nach §§ 24, 26, 35a, 35b, 37, 38 und 41 Abgeordnetengesetz",231892.27
79,411120212,"Altersentschädigung an ausgeschiedene Mitglieder des Deutschen Bundestages sowie Hinterbliebenenversorgung nach §§ 19 bis 22, 25, 26, 35, 35a, 35b, 35c, 37 und 38 Abgeordnetengesetz",51442569.16,"Altersentschädigung an ausgeschiedene Mitglieder des Deutschen Bundestages sowie Hinterbliebenenversorgung nach §§ 19 bis 22, 25, 26, 35, 35a, 35b, 35c, 37 und 38 Abgeordnetengesetz",47617082.04
80,411160212,Inlandsdienst- und Mandatsreisen der Abgeordneten nach §§ 16 und 17 Abgeordnetengesetz,5255317.19,Inlandsdienst- und Mandatsreisen der Abgeordneten nach §§ 16 und 17 Abgeordnetengesetz,3896873.19
81,411170212,"Auslandsdienstreisen der Abgeordneten nach § 17  Abgeordnetengesetz, ohne Reisen zu internationalen parlamentarischen Versammlungen",4754323.35,"Auslandsdienstreisen der Abgeordneten nach § 17  Abgeordnetengesetz, ohne Reisen zu internationalen parlamentarischen Versammlungen",261893.01
82,411180212,Reisen zu internationalen parlamentarischen Versammlungen,713011.52,Reisen zu internationalen parlamentarischen Versammlungen,157853.12
83,411190212,Aufwendungen zur Nutzung des gemeinsamen Informations- und Kommunikationssystems des Deutschen Bundestages sowie für Geschäftsbedarf nach § 12  Abs. 4 Nrn. 1 und 4 Abgeordnetengesetz,7698483.99,Aufwendungen zur Nutzung des gemeinsamen Informations- und Kommunikationssystems des Deutschen Bundestages sowie für Geschäftsbedarf nach § 12  Abs. 4 Nrn. 1 und 4 Abgeordnetengesetz,7214633.69
84,411200212,Kostenerstattung für die Benutzung der Verkehrsmittel der Deutschen Bahn und der Berliner Verkehrsbetriebe durch die Mitglieder des Deutschen Bundestages,2704702.16,Kostenerstattung für die Benutzung der Verkehrsmittel der Deutschen Bahn und der Berliner Verkehrsbetriebe durch die Mitglieder des Deutschen Bundestages,2459751.12
85,684010212,Geldleistungen an die Fraktionen des Deutschen Bundestages,125173590.17,Geldleistungen an die Fraktionen des Deutschen Bundestages,121882970.6
86,685010212,Zuschuss an Institute zur Technikfolgenabschätzung,2519111.43,Zuschuss an Institute zur Technikfolgenabschätzung,2318495.86
87,685020212,Förderung des Deutschen Instituts für Menschenrechte,5174000.0,Förderung des Deutschen Instituts für Menschenrechte,3115000.0
88,685120212,Förderung von Einrichtungen für parlamentarische Zwecke,4020108.69,Förderung von Einrichtungen für parlamentarische Zwecke,3713811.01
89,687010212,Leistungen an internationale Organisationen/Leistungen im Zusammenhang mit internationalen Mitgliedschaften,1655255.15,Leistungen an internationale Organisationen/Leistungen im Zusammenhang mit internationalen Mitgliedschaften,1395018.87
90,687020212,Förderung des deutsch-amerikanischen Jugendaustausches,5546033.69,Förderung des deutsch-amerikanischen Jugendaustausches,3967509.15
91,981030212,Verrechnungsausgaben gemäß § 61 BHO außerhalb der Tit. 981 .1 und 981 .7,1121645.23,Verrechnungsausgaben gemäß § 61 BHO außerhalb der Tit. 981 .1 und 981 .7,346884.82
92,422010212,Bezüge und Nebenleistungen der planmäßigen Beamtinnen und Beamten,75606184.12,Bezüge und Nebenleistungen der planmäßigen Beamtinnen und Beamten,70614703.38
93,422020212,Bezüge und Nebenleistungen der beamteten Hilfskräfte,365980.54,Bezüge und Nebenleistungen der beamteten Hilfskräfte,59890.24
94,422030212,Bezüge der Anwärterinnen und Anwärter sowie Nebenleistungen der Beamtinnen und Beamten auf Widerruf im Vorbereitungsdienst,478148.72,Bezüge der Anwärterinnen und Anwärter sowie Nebenleistungen der Beamtinnen und Beamten auf Widerruf im Vorbereitungsdienst,389804.59
95,427090212,"Entgelte für Arbeitskräfte mit befristeten Verträgen, sonstige Beschäftigungsentgelte (auch für Auszubildende) sowie Aufwendungen für nebenberuflich und nebenamtlich Tätige",7620826.83,"Entgelte für Arbeitskräfte mit befristeten Verträgen, sonstige Beschäftigungsentgelte (auch für Auszubildende) sowie Aufwendungen für nebenberuflich und nebenamtlich Tätige",7635175.37
96,428010212,Entgelte der Arbeitnehmerinnen und Arbeitnehmer,94501388.77,Entgelte der Arbeitnehmerinnen und Arbeitnehmer,87056929.35
97,453010212,"Trennungsgeld, Fahrtkostenzuschüsse sowie Umzugskostenvergütungen",218766.25,"Trennungsgeld, Fahrtkostenzuschüsse sowie Umzugskostenvergütungen",251549.25
98,459090212,Vermischte Personalausgaben,11117.25,Vermischte Personalausgaben,5463.0
99,511010212,"Geschäftsbedarf und Kommunikation sowie Geräte, Ausstattungs- und Ausrüstungsgegenstände, sonstige Gebrauchsgegenstände, Software, Wartung",7467847.25,"Geschäftsbedarf und Kommunikation sowie Geräte, Ausstattungs- und Ausrüstungsgegenstände, sonstige Gebrauchsgegenstände, Software, Wartung",7632002.72
100,514010212,"Verbrauchsmittel, Haltung von Fahrzeugen und dgl.",405907.23,"Verbrauchsmittel, Haltung von Fahrzeugen und dgl.",804621.57
101,517010212,"Bewirtschaftung der Grundstücke, Gebäude und Räume",65882150.01,"Bewirtschaftung der Grundstücke, Gebäude und Räume",53112034.98
102,518010212,Mieten und Pachten,22144075.96,Mieten und Pachten,24642491.41
103,519010212,Unterhaltung der Grundstücke und baulichen Anlagen,15629471.63,Unterhaltung der Grundstücke und baulichen Anlagen,10507385.58
104,525010212,Aus- und Fortbildung,781471.55,Aus- und Fortbildung,488577.14
105,526030212,Ausgaben für parlamentarische Gremien und Bürgerräte,1560439.06,Ausgaben für parlamentarische Gremien,822696.53
106,527010212,Dienstreisen,1276844.73,Dienstreisen,214716.96
107,531020212,Besucherdienst,6246259.77,Besucherdienst,1204831.01
108,531050212,"Erinnerungskultur, historische Ausstellung, Veranstaltungen und Festakte",4138691.14,Ausgaben für die historische Ausstellung und weitere Ausstellungen,1112194.64
109,532010212,Aufträge und Dienstleistungen im Bereich Informationstechnik,6609055.36,Aufträge und Dienstleistungen im Bereich Informationstechnik,3251682.2
110,532040212,Ausgaben für außeramtliche Übersetzungs- und Dolmetschertätigkeit,1625095.45,Ausgaben für außeramtliche Übersetzungs- und Dolmetschertätigkeit,653986.0
111,532050212,Ausgaben für das zeitgeschichtliche Archiv des Deutschen Bundestages,621323.47,Ausgaben für das zeitgeschichtliche Archiv des Deutschen Bundestages,1144036.05
112,532060212,Ausgaben zur Förderung der zwischenstaatlichen Zusammenarbeit,1994897.43,Ausgaben zur Förderung der zwischenstaatlichen Zusammenarbeit,2070895.79
113,539990212,Vermischte Verwaltungsausgaben,1676095.37,Vermischte Verwaltungsausgaben,1328958.89
114,711010212,"Kleine Neu-, Um- und Erweiterungsbauten",205470.62,"Kleine Neu-, Um- und Erweiterungsbauten",2736095.09
115,811010212,Erwerb von Fahrzeugen,337064.17,Erwerb von Fahrzeugen,312928.08
116,812010212,"Erwerb von Geräten, Ausstattungs- und Ausrüstungsgegenständen für Verwaltungszwecke (ohne IT)",2109361.04,"Erwerb von Geräten, Ausstattungs- und Ausrüstungsgegenständen für Verwaltungszwecke (ohne IT)",1237000.04
117,812020212,"Erwerb von Anlagen, Geräten, Ausstattungs- und Ausrüstungsgegenständen sowie Software im Bereich Informationstechnik",6888388.95,"Erwerb von Anlagen, Geräten, Ausstattungs- und Ausrüstungsgegenständen sowie Software im Bereich Informationstechnik",2356162.93
118,812030212,"Erwerb von Geräten, Ausstattungs- und Ausrüstungsgegenständen zur Verbesserung der Arbeitsmöglichkeiten für Abgeordnete und Gremien des Deutschen Bundestages",3382435.02,"Erwerb von Geräten, Ausstattungs- und Ausrüstungsgegenständen zur Verbesserung der Arbeitsmöglichkeiten für Abgeordnete und Gremien des Deutschen Bundestages",4169175.4
119,812040212,Erwerb zeitgenössischer Kunstwerke,259098.5,Erwerb zeitgenössischer Kunstwerke,480130.02
120,812060212,"Beschaffung und Einrichtung von Fernmeldeanlagen u. Ä. für Abgeordnete, die Wehrbeauftragte des Deutschen Bundestages sowie den Ständigen Bevollmächtigten des Parlamentarischen Kontrollgremiums",467058.8,"Beschaffung und Einrichtung von Fernmeldeanlagen u. Ä. für Abgeordnete, die Wehrbeauftragte des Deutschen Bundestages sowie den Ständigen Bevollmächtigten des Parlamentarischen Kontrollgremiums",355494.65
121,428910212,Entgelte der Arbeitnehmerinnen und Arbeitnehmer,1564546.8,Entgelte der Arbeitnehmerinnen und Arbeitnehmer,1456099.16
122,517910212,"Bewirtschaftung der Grundstücke, Gebäude und Räume",188550.08,"Bewirtschaftung der Grundstücke, Gebäude und Räume",183725.52
123,519910212,Unterhaltung der Grundstücke und baulichen Anlagen,38908.52,Unterhaltung der Grundstücke und baulichen Anlagen,105797.31
124,547910212,Nicht aufteilbare sächliche Verwaltungsausgaben,132356.92,Nicht aufteilbare sächliche Verwaltungsausgaben,150957.9
125,427590212,"Entgelte für Arbeitskräfte mit befristeten Verträgen, sonstige Beschäftigungsentgelte (auch für Auszubildende) sowie Aufwendungen für nebenberuflich und nebenamtlich Tätige",145912.84,"Entgelte für Arbeitskräfte mit befristeten Verträgen, sonstige Beschäftigungsentgelte (auch für Auszubildende) sowie Aufwendungen für nebenberuflich und nebenamtlich Tätige",111992.55
126,511560212,"Geschäftsbedarf und Datenübertragung sowie Geräte, Ausstattungs- und Ausrüstungsgegenstände, Software, Wartung",4087886.77,"Geschäftsbedarf und Datenübertragung sowie Geräte, Ausstattungs- und Ausrüstungsgegenstände, Software, Wartung",4453954.22
127,525560212,Aus- und Fortbildung,125673.36,Aus- und Fortbildung,132757.12
128,532510212,Aufträge und Dienstleistungen im Bereich Informationstechnik,16130534.74,Aufträge und Dienstleistungen im Bereich Informationstechnik,13468587.26
129,711560212,"Kleine Neu-, Um- und Erweiterungsbauten",551899.07,"Kleine Neu-, Um- und Erweiterungsbauten",277917.34
130,712560212,Baumaßnahmen von mehr als 6 000 000 € im Einzelfall,1372144.12,Baumaßnahmen von mehr als 6 000 000 € im Einzelfall,506811.72
131,812520212,"Erwerb von Anlagen, Geräten, Ausstattungs- und Ausrüstungsgegenständen sowie Software im Bereich Informationstechnik",6906975.11,"Erwerb von Anlagen, Geräten, Ausstattungs- und Ausrüstungsgegenständen sowie Software im Bereich Informationstechnik",8159219.11
132,132010213,Erlöse aus der Veräußerung von beweglichen Sachen,60124.35,Erlöse aus der Veräußerung von beweglichen Sachen,53429.99
133,421010213,Bezüge der Wehrbeauftragten,194508.16,Bezüge der Wehrbeauftragten,188711.52
134,422010213,Bezüge und Nebenleistungen der planmäßigen Beamtinnen und Beamten,1998017.19,Bezüge und Nebenleistungen der planmäßigen Beamtinnen und Beamten,1895513.21
135,428010213,Entgelte der Arbeitnehmerinnen und Arbeitnehmer,1885966.62,Entgelte der Arbeitnehmerinnen und Arbeitnehmer,1556791.9
136,517010213,"Bewirtschaftung der Grundstücke, Gebäude und Räume",218173.96,"Bewirtschaftung der Grundstücke, Gebäude und Räume",220719.59
137,519010213,Unterhaltung der Grundstücke und baulichen Anlagen,17209.73,Unterhaltung der Grundstücke und baulichen Anlagen,20084.01
138,527010213,Dienstreisen,126377.58,Dienstreisen,73753.71
139,539990213,Vermischte Verwaltungsausgaben,65627.22,Vermischte Verwaltungsausgaben,50343.71
140,545010213,"Konferenzen, Tagungen, Messen und Ausstellungen",4857.66,"Konferenzen, Tagungen, Messen und Ausstellungen",2115.09
141,811010213,Erwerb von Fahrzeugen,56389.8,Erwerb von Fahrzeugen,51566.67
142,411010215,Entschädigung nach § 9 Europaabgeordnetengesetz,475387.75,Entschädigung nach § 9 Europaabgeordnetengesetz,480991.2
143,411040215,"Zuschuss zu den Kosten in Krankheits-, Pflege- und Geburtsfällen sowie Unterstützungen nach § 11 Europaabgeordnetengesetz",368958.97,"Zuschuss zu den Kosten in Krankheits-, Pflege- und Geburtsfällen sowie Unterstützungen nach § 11 Europaabgeordnetengesetz",369578.04
144,411120215,Altersentschädigung an ausgeschiedene Mitglieder des Europäischen Parlaments sowie Hinterbliebenenversorgung nach § 10 b Europaabgeordnetengesetz,5905311.7,Altersentschädigung an ausgeschiedene Mitglieder des Europäischen Parlaments sowie Hinterbliebenenversorgung nach § 10 b Europaabgeordnetengesetz,5595589.07
145,411200215,Kostenerstattung an die Deutsche Bahn für die Benutzung ihrer Verkehrsmittel durch die deutschen Mitglieder des Europäischen Parlaments,347280.81,Kostenerstattung an die Deutsche Bahn für die Benutzung ihrer Verkehrsmittel durch die deutschen Mitglieder des Europäischen Parlaments,317469.29
146,422010216,Bezüge und Nebenleistungen der planmäßigen Beamtinnen und Beamten,1508557.83,Bezüge und Nebenleistungen der planmäßigen Beamtinnen und Beamten,1093868.4
147,422020216,Bezüge und Nebenleistungen der beamteten Hilfskräfte,102268.29,Bezüge und Nebenleistungen der beamteten Hilfskräfte,91242.86
148,428010216,Entgelte der Arbeitnehmerinnen und Arbeitnehmer,592776.36,Entgelte der Arbeitnehmerinnen und Arbeitnehmer,468813.12
149,517010216,"Bewirtschaftung der Grundstücke, Gebäude und Räume",103397.67,"Bewirtschaftung der Grundstücke, Gebäude und Räume",85131.59
150,526050216,Ausgaben für die Kommission nach Art. 10 des Grundgesetzes und das Parlamentarische Kontrollgremium,280232.4,Ausgaben für die Kommission nach Art. 10 des Grundgesetzes und das Parlamentarische Kontrollgremium,158198.86
151,527010216,Dienstreisen,53710.98,Dienstreisen,2841.94
152,539990216,Vermischte Verwaltungsausgaben,31384.69,Vermischte Verwaltungsausgaben,10458.01
153,421010217,Bezüge der Bundesbeauftragten für die Opfer der SED-Diktatur beim Deutschen Bundestag,135989.92,Bezüge der/des Bundesbeauftragten für die Opfer des SED-Diktatur beim Deutschen Bundestag,76708.59
