1214,381030633,Verrechnungseinnahmen gemäß § 61 BHO außerhalb der Tit. 381 .1 und 381 .7,27484873.72,Verrechnungseinnahmen gemäß § 61 BHO außerhalb der Tit. 381 .1 und 381 .7,28088517.67
1215,518020633,Mieten und Pachten im Zusammenhang mit dem Einheitlichen Liegenschaftsmanagement,46315667.67,Mieten und Pachten im Zusammenhang mit dem Einheitlichen Liegenschaftsmanagement,48329522.5
1216,981030633,Verrechnungsausgaben gemäß § 61 BHO außerhalb der Tit. 981 .1 und 981 .7,88512.36,Verrechnungsausgaben gemäß § 61 BHO außerhalb der Tit. 981 .1 und 981 .7,184501.67
1217,422010633,Bezüge und Nebenleistungen der planmäßigen Beamtinnen und Beamten,206447405.92,Bezüge und Nebenleistungen der planmäßigen Beamtinnen und Beamten,160109323.03
1218,422020633,Bezüge und Nebenleistungen der beamteten Hilfskräfte,3143484.25,Bezüge und Nebenleistungen der beamteten Hilfskräfte,5606347.78
1219,422030633,Bezüge der Anwärterinnen und Anwärter sowie Nebenleistungen der Beamtinnen und Beamten auf Widerruf im Vorbereitungsdienst,105973.38,Bezüge der Anwärterinnen und Anwärter sowie Nebenleistungen der Beamtinnen und Beamten auf Widerruf im Vorbereitungsdienst,107869.53
1220,427090633,"Entgelte für Arbeitskräfte mit befristeten Verträgen, sonstige Beschäftigungsentgelte (auch für Auszubildende) sowie Aufwendungen für nebenberuflich und nebenamtlich Tätige",4676649.53,"Entgelte für Arbeitskräfte mit befristeten Verträgen, sonstige Beschäftigungsentgelte (auch für Auszubildende) sowie Aufwendungen für nebenberuflich und nebenamtlich Tätige",4383987.51
1221,428010633,Entgelte der Arbeitnehmerinnen und Arbeitnehmer,243531730.38,Entgelte der Arbeitnehmerinnen und Arbeitnehmer,249508691.84
1222,453010633,"Trennungsgeld, Fahrtkostenzuschüsse sowie Umzugskostenvergütungen",1399769.02,"Trennungsgeld, Fahrtkostenzuschüsse sowie Umzugskostenvergütungen",1114449.15
1223,511010633,"Geschäftsbedarf und Kommunikation sowie Geräte, Ausstattungs- und Ausrüstungsgegenstände, sonstige Gebrauchsgegenstände, Software, Wartung",35324542.74,"Geschäftsbedarf und Kommunikation sowie Geräte, Ausstattungs- und Ausrüstungsgegenstände, sonstige Gebrauchsgegenstände, Software, Wartung",16121929.87
1224,514010633,"Verbrauchsmittel, Haltung von Fahrzeugen und dgl.",296765.16,"Verbrauchsmittel, Haltung von Fahrzeugen und dgl.",192189.99
1225,517010633,"Bewirtschaftung der Grundstücke, Gebäude und Räume",46289781.56,"Bewirtschaftung der Grundstücke, Gebäude und Räume",37207617.25
1226,518010633,Mieten und Pachten,1424403.27,Mieten und Pachten,1273873.39
1227,519010633,Unterhaltung der Grundstücke und baulichen Anlagen,669577.67,Unterhaltung der Grundstücke und baulichen Anlagen,1210992.41
1228,525010633,Aus- und Fortbildung,2970813.23,Aus- und Fortbildung,1712407.28
1229,527010633,Dienstreisen,3280444.98,Dienstreisen,1235388.88
1230,532010633,Aufträge und Dienstleistungen im Bereich Informationstechnik,132184850.05,Aufträge und Dienstleistungen im Bereich Informationstechnik,102805989.83
1231,532020633,Behördenspezifische fachbezogene Verwaltungsausgaben (ohne IT),114675101.92,Behördenspezifische fachbezogene Verwaltungsausgaben (ohne IT),66764317.47
1232,539990633,Vermischte Verwaltungsausgaben,933339.93,Vermischte Verwaltungsausgaben,685665.89
1233,544010633,"Forschung, Untersuchungen und Ähnliches",1608821.99,"Forschung, Untersuchungen und Ähnliches",532519.65
1234,711010633,"Kleine Neu-, Um- und Erweiterungsbauten",1586859.1,"Kleine Neu-, Um- und Erweiterungsbauten",1883032.18
1235,811010633,Erwerb von Fahrzeugen,239495.42,Erwerb von Fahrzeugen,683519.89
1236,812010633,"Erwerb von Geräten, Ausstattungs- und Ausrüstungsgegenständen für Verwaltungszwecke (ohne IT)",2484946.85,"Erwerb von Geräten, Ausstattungs- und Ausrüstungsgegenständen für Verwaltungszwecke (ohne IT)",2858617.25
1237,812020633,"Erwerb von Anlagen, Geräten, Ausstattungs- und Ausrüstungsgegenständen sowie Software im Bereich Informationstechnik",25800053.37,"Erwerb von Anlagen, Geräten, Ausstattungs- und Ausrüstungsgegenständen sowie Software im Bereich Informationstechnik",37834867.68
1238,124010634,"Einnahmen aus Vermietung, Verpachtung und Nutzung",1807603.28,"Einnahmen aus Vermietung, Verpachtung und Nutzung",266497.29
1239,132010634,Erlöse aus der Veräußerung von beweglichen Sachen,22870.45,Erlöse aus der Veräußerung von beweglichen Sachen,87796.4
1240,261010634,Erstattung von Verwaltungsausgaben für die Mitbenutzung der Hochschuleinrichtungen,236263.94,Erstattung von Verwaltungsausgaben für die Mitbenutzung der Hochschuleinrichtungen,258939.03
1241,381010634,Leistungen von Bundesbehörden zur Durchführung von Aufträgen,503390.01,Leistungen von Bundesbehörden zur Durchführung von Aufträgen,618161.65
1242,381030634,Verrechnungseinnahmen gemäß § 61 BHO außerhalb der Tit. 381 .1 und 381 .7,36402.56,Verrechnungseinnahmen gemäß § 61 BHO außerhalb der Tit. 381 .1 und 381 .7,44806.28
1243,518020634,Mieten und Pachten im Zusammenhang mit dem Einheitlichen Liegenschaftsmanagement,5527167.34,Mieten und Pachten im Zusammenhang mit dem Einheitlichen Liegenschaftsmanagement,5585996.88
1244,981030634,Verrechnungsausgaben gemäß § 61 BHO außerhalb der Tit. 981 .1 und 981 .7,94376.47,Verrechnungsausgaben gemäß § 61 BHO außerhalb der Tit. 981 .1 und 981 .7,92188.24
1245,422110634,Bezüge und Nebenleistungen der planmäßigen Beamtinnen und Beamten,781411.27,Bezüge und Nebenleistungen der planmäßigen Beamtinnen und Beamten,871932.11
1246,459190634,Vermischte Personalausgaben,130824.2,Vermischte Personalausgaben,87156.0
1247,547110634,Nicht aufteilbare sächliche Verwaltungsausgaben,131247.08,Nicht aufteilbare sächliche Verwaltungsausgaben,63066.5
1248,422010634,Bezüge und Nebenleistungen der planmäßigen Beamtinnen und Beamten,9852765.93,Bezüge und Nebenleistungen der planmäßigen Beamtinnen und Beamten,8217720.98
1249,422030634,Bezüge der Anwärterinnen und Anwärter sowie Nebenleistungen der Beamtinnen und Beamten auf Widerruf im Vorbereitungsdienst,16408875.27,Bezüge der Anwärterinnen und Anwärter sowie Nebenleistungen der Beamtinnen und Beamten auf Widerruf im Vorbereitungsdienst,11457266.2
1250,427090634,"Entgelte für Arbeitskräfte mit befristeten Verträgen, sonstige Beschäftigungsentgelte (auch für Auszubildende) sowie Aufwendungen für nebenberuflich und nebenamtlich Tätige",367547.34,"Entgelte für Arbeitskräfte mit befristeten Verträgen, sonstige Beschäftigungsentgelte (auch für Auszubildende) sowie Aufwendungen für nebenberuflich und nebenamtlich Tätige",800328.31
1251,428010634,Entgelte der Arbeitnehmerinnen und Arbeitnehmer,4158441.63,Entgelte der Arbeitnehmerinnen und Arbeitnehmer,3628814.87
1252,453010634,"Trennungsgeld, Fahrtkostenzuschüsse sowie Umzugskostenvergütungen",1477194.99,"Trennungsgeld, Fahrtkostenzuschüsse sowie Umzugskostenvergütungen",578082.91
1253,511010634,"Geschäftsbedarf und Kommunikation sowie Geräte, Ausstattungs- und Ausrüstungsgegenstände, sonstige Gebrauchsgegenstände, Software, Wartung",1179320.71,"Geschäftsbedarf und Kommunikation sowie Geräte, Ausstattungs- und Ausrüstungsgegenstände, sonstige Gebrauchsgegenstände, Software, Wartung",1291854.94
1254,517010634,"Bewirtschaftung der Grundstücke, Gebäude und Räume",2664330.1,"Bewirtschaftung der Grundstücke, Gebäude und Räume",2753462.78
1255,519010634,Unterhaltung der Grundstücke und baulichen Anlagen,64383.31,Unterhaltung der Grundstücke und baulichen Anlagen,3247.38
1256,525010634,Aus- und Fortbildung,1238259.22,Aus- und Fortbildung,1070145.67
1257,527010634,Dienstreisen,440490.42,Dienstreisen,100476.88
1258,532010634,Aufträge und Dienstleistungen im Bereich Informationstechnik,284970.97,Aufträge und Dienstleistungen im Bereich Informationstechnik,345400.32
1259,539990634,Vermischte Verwaltungsausgaben,180604.81,Vermischte Verwaltungsausgaben,349445.94
1260,812010634,"Erwerb von Geräten, Ausstattungs- und Ausrüstungsgegenständen für Verwaltungszwecke (ohne IT)",198281.21,"Erwerb von Geräten, Ausstattungs- und Ausrüstungsgegenständen für Verwaltungszwecke (ohne IT)",20213.61
1261,812020634,"Erwerb von Anlagen, Geräten, Ausstattungs- und Ausrüstungsgegenständen sowie Software im Bereich Informationstechnik",1072125.28,"Erwerb von Anlagen, Geräten, Ausstattungs- und Ausrüstungsgegenständen sowie Software im Bereich Informationstechnik",980265.74
1262,119990635,Vermischte Einnahmen,292291.6,Vermischte Einnahmen,235403.21
1263,381030635,Verrechnungseinnahmen gemäß § 61 BHO außerhalb der Tit. 381 .1 und 381 .7,193113.95,Verrechnungseinnahmen gemäß § 61 BHO außerhalb der Tit. 381 .1 und 381 .7,134622.72
1264,518020635,Mieten und Pachten im Zusammenhang mit dem Einheitlichen Liegenschaftsmanagement,2952414.9,Mieten und Pachten im Zusammenhang mit dem Einheitlichen Liegenschaftsmanagement,1593997.74
1265,686010635,Förderung von Projekten für demokratische Teilhabe und gegen Extremismus,14584862.5,Förderung von Projekten für demokratische Teilhabe und gegen Extremismus,11509361.52
1266,422010635,Bezüge und Nebenleistungen der planmäßigen Beamtinnen und Beamten,6071541.7,Bezüge und Nebenleistungen der planmäßigen Beamtinnen und Beamten,4489602.52
1267,427090635,"Entgelte für Arbeitskräfte mit befristeten Verträgen, sonstige Beschäftigungsentgelte (auch für Auszubildende) sowie Aufwendungen für nebenberuflich und nebenamtlich Tätige",2281134.52,"Entgelte für Arbeitskräfte mit befristeten Verträgen, sonstige Beschäftigungsentgelte (auch für Auszubildende) sowie Aufwendungen für nebenberuflich und nebenamtlich Tätige",2268986.59
1268,428010635,Entgelte der Arbeitnehmerinnen und Arbeitnehmer,15732658.42,Entgelte der Arbeitnehmerinnen und Arbeitnehmer,10265336.25
1269,453010635,"Trennungsgeld, Fahrtkostenzuschüsse sowie Umzugskostenvergütungen",44883.75,"Trennungsgeld, Fahrtkostenzuschüsse sowie Umzugskostenvergütungen",8113.87
1270,511010635,"Geschäftsbedarf und Kommunikation sowie Geräte, Ausstattungs- und Ausrüstungsgegenstände, sonstige Gebrauchsgegenstände, Software, Wartung",939860.09,"Geschäftsbedarf und Kommunikation sowie Geräte, Ausstattungs- und Ausrüstungsgegenstände, sonstige Gebrauchsgegenstände, Software, Wartung",732273.32
1271,517010635,"Bewirtschaftung der Grundstücke, Gebäude und Räume",1011304.73,"Bewirtschaftung der Grundstücke, Gebäude und Räume",518295.19
1272,527010635,Dienstreisen,603243.98,Dienstreisen,100401.25
1273,532010635,Aufträge und Dienstleistungen im Bereich Informationstechnik,1406779.46,Aufträge und Dienstleistungen im Bereich Informationstechnik,1574657.54
1274,532020635,Behördenspezifische fachbezogene Verwaltungsausgaben (ohne IT),41485324.75,Behördenspezifische fachbezogene Verwaltungsausgaben (ohne IT),31635719.37
1275,539990635,Vermischte Verwaltungsausgaben,626290.24,Vermischte Verwaltungsausgaben,889041.28
1276,684020635,Zuschüsse für laufende Zwecke an soziale und ähnliche Einrichtungen,15356392.27,Zuschüsse für laufende Zwecke an soziale und ähnliche Einrichtungen,16051611.82
1277,812010635,"Erwerb von Geräten, Ausstattungs- und Ausrüstungsgegenständen für Verwaltungszwecke (ohne IT)",36898.4,"Erwerb von Geräten, Ausstattungs- und Ausrüstungsgegenständen für Verwaltungszwecke (ohne IT)",21533.37
1278,812020635,"Erwerb von Anlagen, Geräten, Ausstattungs- und Ausrüstungsgegenständen sowie Software im Bereich Informationstechnik",1470461.91,"Erwerb von Anlagen, Geräten, Ausstattungs- und Ausrüstungsgegenständen sowie Software im Bereich Informationstechnik",801398.78
1279,119990710,Vermischte Einnahmen,665116.44,Vermischte Einnahmen,532052.22
1280,518020710,Mieten und Pachten im Zusammenhang mit dem Einheitlichen Liegenschaftsmanagement,7721257.92,Mieten und Pachten im Zusammenhang mit dem Einheitlichen Liegenschaftsmanagement,7721257.92
1281,632010710,Zuweisung für Kosten der Deutschen Richterakademie,2444395.55,Zuweisung für Kosten der Deutschen Richterakademie,2332987.7
1282,632050710,Zuweisung zu den Kosten der Kriminologischen Zentralstelle,617739.33,Zuweisung zu den Kosten der Kriminologischen Zentralstelle,525926.37
1283,681010710,Verleihung von Preisen und Auszeichnungen,14043.61,Verleihung von Preisen und Auszeichnungen,9448.07
1284,684010710,Zuschüsse für überregionale Förderungsmaßnahmen,2298158.3,Zuschüsse für überregionale Förderungsmaßnahmen,2152381.2
1285,685010710,Zuschüsse zur Förderung justizspezifischer und rechtspolitischer Vorhaben,2645824.84,Zuschüsse zur Förderung justizspezifischer und rechtspolitischer Vorhaben,2319035.69
1286,685030710,"Überregionale Einrichtungen im Interesse von Gesetzgebung, Rechtsprechung und Verwaltung",3146848.26,"Überregionale Einrichtungen im Interesse von Gesetzgebung, Rechtsprechung und Verwaltung",2160603.66
1287,685080710,Zuführung an die Stiftung Forum Recht,2548726.35,Zuführung an die Stiftung Forum Recht,1691459.93
1288,687010710,Beiträge an internationale Organisationen sowie Verbände und Vereine,440739.11,Beiträge an internationale Organisationen sowie Verbände und Vereine,326773.12
1289,687020710,Beitrag zu den laufenden Kosten des Internationalen Seegerichtshofs,914920.0,Beitrag zu den laufenden Kosten des Internationalen Seegerichtshofs,734313.0
1290,687880710,Beratungshilfe für den Aufbau von Demokratie und Marktwirtschaft,7253000.0,Beratungshilfe für den Aufbau von Demokratie und Marktwirtschaft,6725771.85
1291,981030710,Verrechnungsausgaben gemäß § 61 BHO außerhalb der Tit. 981 .1 und 981 .7,1280954.41,Verrechnungsausgaben gemäß § 61 BHO außerhalb der Tit. 981 .1 und 981 .7,104318.24
1292,511010710,"Geschäftsbedarf und Kommunikation sowie Geräte, Ausstattungs- und Ausrüstungsgegenstände, sonstige Gebrauchsgegenstände, Software, Wartung",49652.21,"Geschäftsbedarf und Kommunikation sowie Geräte, Ausstattungs- und Ausrüstungsgegenstände, sonstige Gebrauchsgegenstände, Software, Wartung",21347.52
1293,232570711,Beteiligung an den Versorgungslasten des Bundes,799153.43,Beteiligung an den Versorgungslasten des Bundes,724377.33
1294,529010711,Außergewöhnlicher Aufwand aus dienstlicher Veranlassung in besonderen Fällen,104216.81,Außergewöhnlicher Aufwand aus dienstlicher Veranlassung in besonderen Fällen,27727.79
1295,531020711,Abgeltung von Ansprüchen nach dem Urheberrecht,150953.32,Abgeltung von Ansprüchen nach dem Urheberrecht,136773.12
1296,542010711,Öffentlichkeitsarbeit,573486.46,Öffentlichkeitsarbeit,744163.97
1297,981030711,Verrechnungsausgaben gemäß § 61 BHO außerhalb der Tit. 981 .1 und 981 .7,436249.8,Verrechnungsausgaben gemäß § 61 BHO außerhalb der Tit. 981 .1 und 981 .7,377231.43
1298,981070711,Leistungen an Bundesbehörden zur Durchführung von ressortübergreifenden Aufgaben,90918.68,Leistungen an Bundesbehörden zur Durchführung von ressortübergreifenden Aufgaben,65511.23
1299,431570711,"Versorgungsbezüge der Bundesministerinnen und Bundesminister und der Parlamentarischen Staatssekretärinnen und Staatssekretäre, sonstiger Amtsträger und deren Hinterbliebenen",953143.2,"Versorgungsbezüge der Bundesministerinnen und Bundesminister und der Parlamentarischen Staatssekretärinnen und Staatssekretäre, sonstiger Amtsträger und deren Hinterbliebenen",905260.07
1300,432570711,Versorgungsbezüge,139727044.24,Versorgungsbezüge,133765323.43
1301,434570711,Zuführung an die Versorgungsrücklage,6452716.2,Zuführung an die Versorgungsrücklage,5976360.34
1302,443570711,Fürsorgeleistungen und Unterstützungen einschließlich Inanspruchnahme von besonderen Fachdiensten/-kräften,13492.84,Fürsorgeleistungen und Unterstützungen einschließlich Inanspruchnahme von besonderen Fachdiensten/-kräften,12570.11
1303,446570711,Beihilfen aufgrund der Beihilfevorschriften,23602864.12,Beihilfen aufgrund der Beihilfevorschriften,19935581.55
1304,632570711,Erstattungen des Bundes für Versorgungslasten,1861852.09,Erstattungen des Bundes für Versorgungslasten,2191035.17
1305,424010711,Zuführung an die Versorgungsrücklage,6996713.27,Zuführung an die Versorgungsrücklage,5662344.04
1306,441010711,Beihilfen aufgrund der Beihilfevorschriften,16112854.24,Beihilfen aufgrund der Beihilfevorschriften,13295147.38
1307,443010711,Fürsorgeleistungen und Unterstützungen einschließlich Inanspruchnahme von besonderen Fachdiensten/-kräften,927092.68,Fürsorgeleistungen und Unterstützungen einschließlich Inanspruchnahme von besonderen Fachdiensten/-kräften,1366057.65
1308,452020711,Unfallversicherung Bund und Bahn,273758.75,Unfallversicherung Bund und Bahn,294590.14
1309,526010711,Gerichts- und ähnliche Kosten,1094798.48,Gerichts- und ähnliche Kosten,1787334.33
1310,526020711,"Sachverständige, Ausgaben für Mitglieder von Fachbeiräten und ähnlichen Ausschüssen",647616.32,"Sachverständige, Ausgaben für Mitglieder von Fachbeiräten und ähnlichen Ausschüssen",1052534.87
1311,527030711,Reisen in Angelegenheiten der Personalvertretungen und der Gleichstellungsbeauftragten sowie in Vertretung der Interessen schwerbehinderter Menschen,202512.64,Reisen in Angelegenheiten der Personalvertretungen und der Gleichstellungsbeauftragten sowie in Vertretung der Interessen schwerbehinderter Menschen,81723.51
1312,543010711,Veröffentlichungen und Fachinformationen,2716727.38,Veröffentlichungen und Fachinformationen,2074594.09
1313,545010711,"Konferenzen, Tagungen, Messen und Ausstellungen",642499.78,"Konferenzen, Tagungen, Messen und Ausstellungen",174088.49
1314,634030711,Zuweisungen an den Versorgungsfonds,63721589.01,Zuweisungen an den Versorgungsfonds,54741123.29
1315,111010712,"Gebühren, sonstige Entgelte",3596.25,"Gebühren, sonstige Entgelte",1297.0
1316,119010712,Einnahmen aus Veröffentlichungen,13642291.18,Einnahmen aus Veröffentlichungen,16499520.05
1317,119990712,Vermischte Einnahmen,33491.16,Vermischte Einnahmen,16208.14
1318,121030712,Gewinn aus der Beteiligung an der juris GmbH,3124547.19,Gewinn aus der Beteiligung an der juris GmbH,2897627.21
1319,381030712,Verrechnungseinnahmen gemäß § 61 BHO außerhalb der Tit. 381 .1 und 381 .7,6140.4,Verrechnungseinnahmen gemäß § 61 BHO außerhalb der Tit. 381 .1 und 381 .7,288643.28
1320,518020712,Mieten und Pachten im Zusammenhang mit dem Einheitlichen Liegenschaftsmanagement,19608457.28,Mieten und Pachten im Zusammenhang mit dem Einheitlichen Liegenschaftsmanagement,17330689.52
1321,532040712,Kosten für das Vorhalten von Datenbanken durch die juris GmbH,3838688.7,Kosten für das Vorhalten von Datenbanken durch die juris GmbH,3838688.7
1322,532070712,Kosten der Pflege internationaler Beziehungen auf dem Gebiet des Rechts,450054.87,Kosten der Pflege internationaler Beziehungen auf dem Gebiet des Rechts,321610.55
1323,681010712,Entschädigungsleistungen,23116.5,Entschädigungsleistungen,26198.86
1324,981030712,Verrechnungsausgaben gemäß § 61 BHO außerhalb der Tit. 981 .1 und 981 .7,41015.48,Verrechnungsausgaben gemäß § 61 BHO außerhalb der Tit. 981 .1 und 981 .7,40826.38
1325,421010712,Bezüge des Bundesministers und des Parlamentarischen Staatssekretärs,365426.84,"Bezüge der Bundesministerin, der Parlamentarischen Staatssekretärin und des Parlamentarischen Staatssekretärs",530137.33
1326,422010712,Bezüge und Nebenleistungen der planmäßigen Beamtinnen und Beamten,42012092.41,Bezüge und Nebenleistungen der planmäßigen Beamtinnen und Beamten,37652147.33
1327,422020712,Bezüge und Nebenleistungen der beamteten Hilfskräfte,9975565.1,Bezüge und Nebenleistungen der beamteten Hilfskräfte,12314707.48
1328,427090712,"Entgelte für Arbeitskräfte mit befristeten Verträgen, sonstige Beschäftigungsentgelte (auch für Auszubildende) sowie Aufwendungen für nebenberuflich und nebenamtlich Tätige",2638510.76,"Entgelte für Arbeitskräfte mit befristeten Verträgen, sonstige Beschäftigungsentgelte (auch für Auszubildende) sowie Aufwendungen für nebenberuflich und nebenamtlich Tätige",3112696.19
1329,428010712,Entgelte der Arbeitnehmerinnen und Arbeitnehmer,16387228.12,Entgelte der Arbeitnehmerinnen und Arbeitnehmer,15522717.74
1330,453010712,"Trennungsgeld, Fahrtkostenzuschüsse sowie Umzugskostenvergütungen",1322477.88,"Trennungsgeld, Fahrtkostenzuschüsse sowie Umzugskostenvergütungen",1384490.57
1331,511010712,"Geschäftsbedarf und Kommunikation sowie Geräte, Ausstattungs- und Ausrüstungsgegenstände, sonstige Gebrauchsgegenstände, Software, Wartung",2783287.85,"Geschäftsbedarf und Kommunikation sowie Geräte, Ausstattungs- und Ausrüstungsgegenstände, sonstige Gebrauchsgegenstände, Software, Wartung",2756066.89
1332,517010712,"Bewirtschaftung der Grundstücke, Gebäude und Räume",5737908.63,"Bewirtschaftung der Grundstücke, Gebäude und Räume",4886857.28
1333,519010712,Unterhaltung der Grundstücke und baulichen Anlagen,1417.77,Unterhaltung der Grundstücke und baulichen Anlagen,19000.09
1334,525010712,Aus- und Fortbildung,233556.01,Aus- und Fortbildung,147800.44
1335,527010712,Dienstreisen,877934.54,Dienstreisen,213953.16
1336,532010712,Aufträge und Dienstleistungen im Bereich Informationstechnik,8879743.4,Aufträge und Dienstleistungen im Bereich Informationstechnik,3645619.57
1337,532030712,Sonstige Dienstleistungsaufträge an Dritte,3066603.06,Sonstige Dienstleistungsaufträge an Dritte,1016584.82
1338,539990712,Vermischte Verwaltungsausgaben,353306.56,Vermischte Verwaltungsausgaben,895232.36
1339,544010712,"Forschung, Untersuchungen und Ähnliches",717575.8,"Forschung, Untersuchungen und Ähnliches",1043184.88
1340,812010712,"Erwerb von Geräten, Ausstattungs- und Ausrüstungsgegenständen für Verwaltungszwecke (ohne IT)",149543.1,"Erwerb von Geräten, Ausstattungs- und Ausrüstungsgegenständen für Verwaltungszwecke (ohne IT)",80591.11
1341,812020712,"Erwerb von Anlagen, Geräten, Ausstattungs- und Ausrüstungsgegenständen sowie Software im Bereich Informationstechnik",3732683.41,"Erwerb von Anlagen, Geräten, Ausstattungs- und Ausrüstungsgegenständen sowie Software im Bereich Informationstechnik",2736890.66
1342,412110712,Aufwandsentschädigung für den Beauftragten der Bundesregierung für die Anliegen von Betroffenen von terroristischen und extremistischen Anschlägen im Inland,42000.0,Aufwandsentschädigung für den Beauftragten der Bundesregierung für die Anliegen von Opfern und Hinterbliebenen von terroristischen Straftaten im Inland,42000.0
1343,539190712,Vermischte Verwaltungsausgaben,57649.5,Vermischte Verwaltungsausgaben,76462.42
1344,111010713,"Gebühren, sonstige Entgelte",20088690.82,"Gebühren, sonstige Entgelte",21522068.04
1345,132010713,Erlöse aus der Veräußerung von beweglichen Sachen,2617.5,Erlöse aus der Veräußerung von beweglichen Sachen,58761.5
1346,518020713,Mieten und Pachten im Zusammenhang mit dem Einheitlichen Liegenschaftsmanagement,4228226.04,Mieten und Pachten im Zusammenhang mit dem Einheitlichen Liegenschaftsmanagement,4038410.97
1347,422010713,"Bezüge und Nebenleistungen der planmäßigen Richterinnen, Richter, Beamtinnen und Beamten",27120202.64,"Bezüge und Nebenleistungen der planmäßigen Richterinnen, Richter, Beamtinnen und Beamten",26454317.36
1348,422020713,Bezüge und Nebenleistungen der beamteten Hilfskräfte,6554643.55,Bezüge und Nebenleistungen der beamteten Hilfskräfte,5123243.66
1349,427090713,"Entgelte für Arbeitskräfte mit befristeten Verträgen, sonstige Beschäftigungsentgelte (auch für Auszubildende) sowie Aufwendungen für nebenberuflich und nebenamtlich Tätige",854132.82,"Entgelte für Arbeitskräfte mit befristeten Verträgen, sonstige Beschäftigungsentgelte (auch für Auszubildende) sowie Aufwendungen für nebenberuflich und nebenamtlich Tätige",655991.96
1350,428010713,Entgelte der Arbeitnehmerinnen und Arbeitnehmer,8604241.84,Entgelte der Arbeitnehmerinnen und Arbeitnehmer,8060583.24
1351,453010713,"Trennungsgeld, Fahrtkostenzuschüsse sowie Umzugskostenvergütungen",569539.53,"Trennungsgeld, Fahrtkostenzuschüsse sowie Umzugskostenvergütungen",583233.87
1352,511010713,"Geschäftsbedarf und Kommunikation sowie Geräte, Ausstattungs- und Ausrüstungsgegenstände, sonstige Gebrauchsgegenstände, Software, Wartung",1654608.36,"Geschäftsbedarf und Kommunikation sowie Geräte, Ausstattungs- und Ausrüstungsgegenstände, sonstige Gebrauchsgegenstände, Software, Wartung",2311454.1
1353,517010713,"Bewirtschaftung der Grundstücke, Gebäude und Räume",1614136.51,"Bewirtschaftung der Grundstücke, Gebäude und Räume",1463228.03
1354,518010713,Mieten und Pachten,998954.57,Mieten und Pachten,6332.07
1355,532010713,Aufträge und Dienstleistungen im Bereich Informationstechnik,279239.53,Aufträge und Dienstleistungen im Bereich Informationstechnik,253331.08
1356,532030713,Sonstige Dienstleistungsaufträge an Dritte,490393.85,Sonstige Dienstleistungsaufträge an Dritte,632280.02
1357,539990713,Vermischte Verwaltungsausgaben,193969.47,Vermischte Verwaltungsausgaben,212958.1
1358,687090713,Mitgliedsbeiträge und sonstige Zuschüsse für laufende Zwecke im Ausland geringeren Umfangs,2000.0,Mitgliedsbeiträge und sonstige Zuschüsse für laufende Zwecke im Ausland geringeren Umfangs,2000.0
1359,811010713,Erwerb von Fahrzeugen,56357.7,Erwerb von Fahrzeugen,73592.76
1360,812010713,"Erwerb von Geräten, Ausstattungs- und Ausrüstungsgegenständen für Verwaltungszwecke (ohne IT)",201001.45,"Erwerb von Geräten, Ausstattungs- und Ausrüstungsgegenständen für Verwaltungszwecke (ohne IT)",162729.65
1361,812020713,"Erwerb von Anlagen, Geräten, Ausstattungs- und Ausrüstungsgegenständen sowie Software im Bereich Informationstechnik",606713.08,"Erwerb von Anlagen, Geräten, Ausstattungs- und Ausrüstungsgegenständen sowie Software im Bereich Informationstechnik",751406.77
1362,112010714,"Geldstrafen, Geldbußen und Gerichtskosten",869053.17,"Geldstrafen, Geldbußen und Gerichtskosten",427725.9
