3416,553691407,"Betreibermodelle und Vorhaltecharter für Flugzeuge, Flugkörper und flugtechnisches Gerät",184539865.82,"Betreibermodelle und Vorhaltecharter für Flugzeuge, Flugkörper und flugtechnisches Gerät",159872292.18
3417,981031407,Verrechnungsausgaben gemäß § 61 BHO außerhalb der Tit. 981 .1 und 981 .7,156244.49,Verrechnungsausgaben gemäß § 61 BHO außerhalb der Tit. 981 .1 und 981 .7,6644.4
3418,511011407,"Geschäftsbedarf und Kommunikation sowie Geräte, Ausstattungs- und Ausrüstungsgegenstände, sonstige Gebrauchsgegenstände, Software, Wartung",11153551.71,"Geschäftsbedarf und Kommunikation sowie Geräte, Ausstattungs- und Ausrüstungsgegenstände, sonstige Gebrauchsgegenstände, Software, Wartung",20306279.5
3419,511031407,Satellitenkommunikation,34475586.92,Satellitenkommunikation,28662089.79
3420,514011407,"Verbrauchsmittel, Haltung von Fahrzeugen und dgl.",8983266.74,"Verbrauchsmittel, Haltung von Fahrzeugen und dgl.",8442790.87
3421,534011407,Schifffahrts- und Hafengebühren sowie durch Ausschiffung im Ausland entstehende sächliche Ausgaben,4006668.52,Schifffahrts- und Hafengebühren sowie durch Ausschiffung im Ausland entstehende sächliche Ausgaben,2761999.66
3422,534021407,Gebühren für die Benutzung ziviler Flugplätze,20606337.81,Gebühren für die Benutzung ziviler Flugplätze,14489072.7
3423,534031407,Kosten der Flugsicherung,68966689.28,Kosten der Flugsicherung,57825766.43
3424,553391407,Betrieb der Fahrzeuge des Flottenmanagements,529133434.34,Betrieb der Fahrzeuge des Flottenmanagements,363288330.78
3425,514111407,"Verbrauchsmittel, Haltung von Fahrzeugen und dgl.",1605611.77,"Verbrauchsmittel, Haltung von Fahrzeugen und dgl.",1308100.01
3426,518111407,Mieten und Pachten,791004.32,Mieten und Pachten,351598.31
3427,534111407,"Betrieb Flugplätze und Depots, einschließlich sonstiger Betriebskosten",4225610.95,"Betrieb Flugplätze und Depots, einschließlich sonstiger Betriebskosten",3512815.35
3428,537111407,Verwertung und Entsorgung von Material der Bundeswehr,8624614.85,Verwertung und Entsorgung von Material der Bundeswehr,3862902.27
3429,538111407,"Transportkosten, soweit nicht bei Kap. 1403 Tit. 538 02 veranschlagt",1589838.65,"Transportkosten, soweit nicht bei Kap. 1403 Tit. 538 02 veranschlagt",1533028.76
3430,547111407,Nicht aufteilbare sächliche Verwaltungsausgaben,6207302.71,Nicht aufteilbare sächliche Verwaltungsausgaben,6307181.3
3431,124011408,"Einnahmen aus Vermietung, Verpachtung und Nutzung",21252263.32,"Einnahmen aus Vermietung, Verpachtung und Nutzung",20062815.37
3432,153011408,Zinseinnahmen aus Darlehen an Gemeinden und Gemeindeverbände,6275.39,Zinseinnahmen aus Darlehen an Gemeinden und Gemeindeverbände,7420.61
3433,173011408,Darlehensrückflüsse von Gemeinden und Gemeindeverbänden,129040.15,Darlehensrückflüsse von Gemeinden und Gemeindeverbänden,167971.59
3434,182011408,Sonstige Darlehensrückflüsse,478928.34,Sonstige Darlehensrückflüsse,574207.13
3435,266011408,Verwaltungszuschlag im Zusammenhang mit der Verwaltung des NATO-Truppenübungsplatzes Bergen,474755.54,Verwaltungszuschlag im Zusammenhang mit der Verwaltung des NATO-Truppenübungsplatzes Bergen,351474.74
3436,286011408,Erstattung der Kosten für die Verwaltung und die Mitbenutzung von NATO-Einrichtungen in Deutschland und damit zusammenhängende Unterstützungsleistungen,26402542.0,Erstattung der Kosten für die Verwaltung und die Mitbenutzung von NATO-Einrichtungen in Deutschland und damit zusammenhängende Unterstützungsleistungen,27680566.59
3437,381031408,Verrechnungseinnahmen gemäß § 61 BHO außerhalb der Tit. 381 .1 und 381 .7,7699097.7,Verrechnungseinnahmen gemäß § 61 BHO außerhalb der Tit. 381 .1 und 381 .7,14476.31
3438,511011408,"Geschäftsbedarf und Kommunikation sowie Geräte, Ausstattungs- und Ausrüstungsgegenstände, sonstige Gebrauchsgegenstände, Software, Wartung",33229570.18,"Geschäftsbedarf und Kommunikation sowie Geräte, Ausstattungs- und Ausrüstungsgegenstände, sonstige Gebrauchsgegenstände, Software, Wartung",30150637.65
3439,517011408,"Bewirtschaftung der Grundstücke, Gebäude und Räume",1391376017.92,"Bewirtschaftung der Grundstücke, Gebäude und Räume",652314776.94
3440,517021408,Absicherung von Liegenschaften,599672076.33,Absicherung von Liegenschaften,530300340.51
3441,517031408,Bewirtschaftung Forsten,52007273.13,Bewirtschaftung Forsten,45326620.61
3442,517091408,Betreibermodelle im Liegenschaftsbereich,10691069.65,Betreibermodelle im Liegenschaftsbereich,9434169.58
3443,518011408,Mieten und Pachten,37868550.42,Mieten und Pachten,70762522.85
3444,518021408,Mieten und Pachten im Zusammenhang mit dem Einheitlichen Liegenschaftsmanagement,2846770269.25,Mieten und Pachten im Zusammenhang mit dem Einheitlichen Liegenschaftsmanagement,2703771223.97
3445,537011408,"Betrieb, Bewirtschaftung und Verwaltung von NATO-Einrichtungen und damit zusammenhängende Unterstützungsleistungen",27622350.12,"Betrieb, Bewirtschaftung und Verwaltung von NATO-Einrichtungen und damit zusammenhängende Unterstützungsleistungen",24763550.06
3446,632011408,Erstattung von Verwaltungsausgaben an die Länder,592318931.12,Erstattung von Verwaltungsausgaben an die Länder,575882709.28
3447,633011408,Zuweisungen an Gemeinden und Gemeindeverbände zur Straßenunterhaltung,173494.01,Zuweisungen an Gemeinden und Gemeindeverbände zur Straßenunterhaltung,129642.42
3448,682011408,Zuschüsse an die Deutsche Bahn AG zur Unterhaltung von Strecken und Gleisabschnitten,1359239.06,Zuschüsse an die Deutsche Bahn AG zur Unterhaltung von Strecken und Gleisabschnitten,1803776.77
3449,686011408,Sonstige Zuschüsse für laufende Zwecke im Inland,1410725.68,Sonstige Zuschüsse für laufende Zwecke im Inland,854813.07
3450,698011408,Entschädigungen im Zusammenhang mit dem Bau und Betrieb von Flug- und Truppenübungsplätzen,1112398.39,Entschädigungen im Zusammenhang mit dem Bau und Betrieb von Flug- und Truppenübungsplätzen,1133249.04
3451,812011408,"Erwerb von Geräten, Ausstattungs- und Ausrüstungsgegenständen für Verwaltungszwecke (ohne IT)",99664420.46,"Erwerb von Geräten, Ausstattungs- und Ausrüstungsgegenständen für Verwaltungszwecke (ohne IT)",81234403.95
3452,821031408,Beschaffung von Liegenschaften für militärische Zwecke und Werterstattungen nach § 61 Abs. 1 BHO für bundeseigene Grundstücke sowie Restwertentschädigungen,2513412.67,Beschaffung von Liegenschaften für militärische Zwecke und Werterstattungen nach § 61 Abs. 1 BHO für bundeseigene Grundstücke sowie Restwertentschädigungen,7168993.7
3453,883021408,Zuweisungen für Investitionen an Gemeinden und Gemeindeverbände,520067.52,Zuweisungen für Investitionen an Gemeinden und Gemeindeverbände,851282.66
3454,519111408,Unterhaltung der Grundstücke und baulichen Anlagen,143568857.6,Unterhaltung der Grundstücke und baulichen Anlagen,138899220.33
3455,539191408,Vermischte Verwaltungsausgaben,1252766.7,Vermischte Verwaltungsausgaben,1357283.06
3456,558111408,"Große Neu-, Um- und Erweiterungsbauten",632773937.24,"Große Neu-, Um- und Erweiterungsbauten",686048866.97
3457,558121408,Nationale Anteile bei den Infrastrukturmaßnahmen des NATO-Sicherheits-Investitionsprogramms,190979000.0,Nationale Anteile bei den Infrastrukturmaßnahmen des NATO-Sicherheits-Investitionsprogramms,44995213.0
3458,558131408,"Kleine Neu-, Um- und Erweiterungsbauten",427500466.73,"Kleine Neu-, Um- und Erweiterungsbauten",322374752.69
3459,882411408,Zuweisungen für Investitionen an die Länder,272122.31,Zuweisungen für Investitionen an die Länder,2778392.41
3460,883411408,Zuweisungen für Investitionen an Gemeinden und Gemeindeverbände,1050635.96,Zuweisungen für Investitionen an Gemeinden und Gemeindeverbände,251835.53
3461,891411408,Zuschüsse für Investitionen an öffentliche Unternehmen,2796324.62,Zuschüsse für Investitionen an öffentliche Unternehmen,2921176.95
3462,893411408,Zuschüsse für Investitionen an sonstige Bedarfsträger,440038.1,Zuschüsse für Investitionen an sonstige Bedarfsträger,1896782.84
3463,111011410,"Gebühren, sonstige Entgelte",84670.76,"Gebühren, sonstige Entgelte",112657.67
3464,112011410,"Geldstrafen, Geldbußen und Gerichtskosten",14572444.66,"Geldstrafen, Geldbußen und Gerichtskosten",7241156.42
3465,119991410,Vermischte Einnahmen,878932996.44,Vermischte Einnahmen,74751809.93
3466,125011410,Leistungen Dritter für Aufträge an militärische oder zivile Dienststellen,20779484.3,Leistungen Dritter für Aufträge an militärische oder zivile Dienststellen,13521497.76
3467,162021410,Zinsen aus Vorauszahlungen sowie aufgrund von Verzug und Stundung aus Inlandsverträgen,236139.1,Zinsen aus Vorauszahlungen sowie aufgrund von Verzug und Stundung aus Inlandsverträgen,678792.01
3468,166021410,Zinsen aus Vorauszahlungen sowie aufgrund von Verzug und Stundung aus Auslandsverträgen,20484.37,Zinsen aus Vorauszahlungen sowie aufgrund von Verzug und Stundung aus Auslandsverträgen,119102.27
3469,261111410,Erstattungen Dritter - Inland -,12021429.22,Erstattungen Dritter - Inland -,12224669.62
3470,266111410,Erstattungen Dritter - Ausland -,2366667.64,Erstattungen Dritter - Ausland -,1013.58
3471,531021410,Abgeltung von Ansprüchen nach dem Urheberrechtsgesetz,1066648.94,Abgeltung von Ansprüchen nach dem Urheberrechtsgesetz,939429.16
3472,534011410,Aufwendungen für die Wahrnehmung von Verpflichtungen im Rahmen der Rüstungskontrolle,738296.67,Aufwendungen für die Wahrnehmung von Verpflichtungen im Rahmen der Rüstungskontrolle,561458.72
3473,537011410,"Hilfs- und Unterstützungsleistungen aus Anlass von Katastrophen, größeren Unglücks-, Notfällen und internationalen Krisensituationen sowie Maßnahmen zur Vorbeugung internationaler Krisensituationen",30841333.65,"Hilfs- und Unterstützungsleistungen aus Anlass von Katastrophen, größeren Unglücks-, Notfällen und internationalen Krisensituationen sowie Maßnahmen zur Vorbeugung internationaler Krisensituationen",13397610.53
3474,681021410,Beihilfen zur fremdsprachlichen Ausbildung von Ehepartnerinnen und Ehepartnern Bundeswehrangehöriger,55000.0,Beihilfen zur fremdsprachlichen Ausbildung von Ehepartnerinnen und Ehepartnern Bundeswehrangehöriger,33869.99
3475,684011410,Unterstützungsleistungen für unverschuldet in Not geratene ehemalige Angehörige der Bundeswehr und der NVA sowie für deren Hinterbliebene,2400000.0,Unterstützungsleistungen für unverschuldet in Not geratene ehemalige Angehörige der Bundeswehr und der NVA sowie für deren Hinterbliebene,1750000.0
3476,686031410,"Förderung wissenschaftlicher, kultureller und sonstiger Einrichtungen durch die Bundeswehr sowie Mitgliedsbeiträge",2947878.89,"Förderung wissenschaftlicher, kultureller und sonstiger Einrichtungen durch die Bundeswehr sowie Mitgliedsbeiträge",3581281.61
3477,698011410,"Abgeltung von Schadensersatzansprüchen Dritter, soweit es sich nicht um Ansprüche aus Übungsschäden handelt",6946796.01,"Abgeltung von Schadensersatzansprüchen Dritter, soweit es sich nicht um Ansprüche aus Übungsschäden handelt",6587360.25
3478,981011410,Leistungen an Bundesbehörden zur Durchführung von Aufträgen,1044602.0,Leistungen an Bundesbehörden zur Durchführung von Aufträgen,1208240.74
3479,282091411,"Einnahmen aus Sponsoring, Spenden und ähnlichen freiwilligen Geldleistungen",451632.5,"Einnahmen aus Sponsoring, Spenden und ähnlichen freiwilligen Geldleistungen",454810.8
3480,119571411,Vermischte Einnahmen,32665.08,Vermischte Einnahmen,16043.76
3481,232571411,Beteiligung an den Versorgungslasten des Bundes,448783.24,Beteiligung an den Versorgungslasten des Bundes,637370.27
3482,529011411,Außergewöhnlicher Aufwand aus dienstlicher Veranlassung in besonderen Fällen,2896383.09,Außergewöhnlicher Aufwand aus dienstlicher Veranlassung in besonderen Fällen,1086794.97
3483,542011411,Öffentlichkeitsarbeit,3182414.57,Öffentlichkeitsarbeit,3639976.89
3484,545011411,"Konferenzen, Tagungen, Messen und Ausstellungen",1050906.68,"Konferenzen, Tagungen, Messen und Ausstellungen",336398.26
3485,547091411,"Ausgaben für Vorhaben, die aus Spenden, Sponsoring und ähnlichen freiwilligen Geldleistungen finanziert werden",453665.18,"Ausgaben für Vorhaben, die aus Spenden, Sponsoring und ähnlichen freiwilligen Geldleistungen finanziert werden",467207.01
3486,981071411,Leistungen an Bundesbehörden zur Durchführung von ressortübergreifenden Aufgaben,25134084.1,Leistungen an Bundesbehörden zur Durchführung von ressortübergreifenden Aufgaben,12753635.91
3487,431571411,"Versorgungsbezüge der Bundesminister, der Parlamentarischen Staatssekretärinnen und der Parlamentarischen Staatssekretäre sowie deren Hinterbliebenen",995143.73,"Versorgungsbezüge der Bundesminister, der Parlamentarischen Staatssekretärinnen und der Parlamentarischen Staatssekretäre sowie deren Hinterbliebenen",784823.95
3488,432571411,Versorgungsbezüge,926810528.88,Versorgungsbezüge,880426653.06
3489,434571411,Zuführung an die Versorgungsrücklage,43561164.61,Zuführung an die Versorgungsrücklage,39311567.56
3490,443571411,Fürsorgeleistungen und Unterstützungen einschließlich Inanspruchnahme von besonderen Fachdiensten/-kräften,71734.26,Fürsorgeleistungen und Unterstützungen einschließlich Inanspruchnahme von besonderen Fachdiensten/-kräften,58796.81
3491,446571411,Beihilfen aufgrund der Beihilfevorschriften,228359513.16,Beihilfen aufgrund der Beihilfevorschriften,183012718.46
3492,453571411,"Trennungsgeld, Fahrtkostenzuschüsse sowie Umzugskostenvergütungen",162652.5,"Trennungsgeld, Fahrtkostenzuschüsse sowie Umzugskostenvergütungen",108384.23
3493,632571411,Erstattungen des Bundes für Versorgungslasten,7773356.89,Erstattungen des Bundes für Versorgungslasten,8826126.11
3494,671571411,Beteiligung an den Versorgungslasten der sonstigen Bereiche,4688070.74,Beteiligung an den Versorgungslasten der sonstigen Bereiche,4688424.57
3495,424011411,Zuführung an die Versorgungsrücklage,38574639.36,Zuführung an die Versorgungsrücklage,33566100.89
3496,441011411,Beihilfen aufgrund der Beihilfevorschriften,150837026.28,Beihilfen aufgrund der Beihilfevorschriften,131575537.68
3497,443011411,Fürsorgeleistungen und Unterstützungen einschließlich Inanspruchnahme von besonderen Fachdiensten/-kräften,21734858.76,Fürsorgeleistungen und Unterstützungen einschließlich Inanspruchnahme von besonderen Fachdiensten/-kräften,19058377.58
3498,452021411,Unfallversicherung Bund und Bahn,23603739.97,Unfallversicherung Bund und Bahn,24071097.54
3499,526011411,Gerichts- und ähnliche Kosten,1604546.64,Gerichts- und ähnliche Kosten,1058238.09
3500,526021411,"Sachverständige, Ausgaben für Mitglieder von Fachbeiräten und ähnlichen Ausschüssen",104899.41,"Sachverständige, Ausgaben für Mitglieder von Fachbeiräten und ähnlichen Ausschüssen",35859.39
3501,527031411,Reisen in Angelegenheiten der Personalvertretungen und der Gleichstellungsbeauftragten sowie in Vertretung der Interessen schwerbehinderter Menschen,8663811.15,Reisen in Angelegenheiten der Personalvertretungen und der Gleichstellungsbeauftragten sowie in Vertretung der Interessen schwerbehinderter Menschen,6342373.76
3502,634031411,Zuweisungen an den Versorgungsfonds,233781101.88,Zuweisungen an den Versorgungsfonds,184709117.29
3503,423011412,Bezüge und Nebenleistungen der Berufssoldatinnen und Berufssoldaten sowie Soldatinnen und Soldaten auf Zeit,100003315.66,Bezüge und Nebenleistungen der Berufssoldatinnen und Berufssoldaten sowie Soldatinnen und Soldaten auf Zeit,92720368.18
3504,535011412,Innere Führung und Sicherheits- und verteidigungspolitische Kommunikation,812083.0,Innere Führung und Sicherheits- und verteidigungspolitische Kommunikation,745362.78
3505,546011412,Förderung des Vorschlagwesens,490662.87,Förderung des Vorschlagwesens,417735.67
3506,421011412,"Bezüge der Bundesministerin, der Parlamentarischen Staatssekretärin und des Parlamentarischen Staatssekretärs",554473.78,Bezüge der Bundesministerin und der Parlamentarischen Staatssekretäre,449788.82
3507,422011412,Bezüge und Nebenleistungen der planmäßigen Beamtinnen und Beamten,110433319.58,Bezüge und Nebenleistungen der planmäßigen Beamtinnen und Beamten,92318099.76
3508,422021412,Bezüge und Nebenleistungen der beamteten Hilfskräfte,776825.21,Bezüge und Nebenleistungen der beamteten Hilfskräfte,209939.79
3509,427091412,"Entgelte für Arbeitskräfte mit befristeten Verträgen, sonstige Beschäftigungsentgelte (auch für Auszubildende) sowie Aufwendungen für nebenberuflich und nebenamtlich Tätige",289388.86,"Entgelte für Arbeitskräfte mit befristeten Verträgen, sonstige Beschäftigungsentgelte (auch für Auszubildende) sowie Aufwendungen für nebenberuflich und nebenamtlich Tätige",268017.74
3510,428011412,Entgelte der Arbeitnehmerinnen und Arbeitnehmer,29214099.43,Entgelte der Arbeitnehmerinnen und Arbeitnehmer,25833888.13
3511,453011412,"Trennungsgeld, Fahrtkostenzuschüsse sowie Umzugskostenvergütungen",11345613.07,"Trennungsgeld, Fahrtkostenzuschüsse sowie Umzugskostenvergütungen",9479422.1
3512,511011412,"Geschäftsbedarf und Kommunikation sowie Geräte, Ausstattungs- und Ausrüstungsgegenstände, sonstige Gebrauchsgegenstände, Software, Wartung",2015205.27,"Geschäftsbedarf und Kommunikation sowie Geräte, Ausstattungs- und Ausrüstungsgegenstände, sonstige Gebrauchsgegenstände, Software, Wartung",1832060.34
3513,517011412,"Bewirtschaftung der Grundstücke, Gebäude und Räume",9699159.88,"Bewirtschaftung der Grundstücke, Gebäude und Räume",7594299.31
3514,518011412,Mieten und Pachten,963024.22,Mieten und Pachten,1805227.66
3515,519011412,Unterhaltung der Grundstücke und baulichen Anlagen,1059199.47,Unterhaltung der Grundstücke und baulichen Anlagen,978878.24
3516,525011412,Aus- und Fortbildung,459930.97,Aus- und Fortbildung,115196.5
3517,527011412,Dienstreisen,8411494.42,Dienstreisen,2423632.64
3518,539991412,Vermischte Verwaltungsausgaben,924869.86,Vermischte Verwaltungsausgaben,1980191.88
3519,711011412,"Kleine Neu-, Um- und Erweiterungsbauten",895288.8,"Kleine Neu-, Um- und Erweiterungsbauten",1498801.73
3520,812011412,"Erwerb von Geräten, Ausstattungs- und Ausrüstungsgegenständen für Verwaltungszwecke (ohne IT)",781085.84,"Erwerb von Geräten, Ausstattungs- und Ausrüstungsgegenständen für Verwaltungszwecke (ohne IT)",1234763.37
3521,121011413,Gewinne aus Unternehmen und Beteiligungen,109804.32,Gewinne aus Unternehmen und Beteiligungen,1316.96
3522,129011413,Leistungen Dritter für Aufträge an die Universitäten der Bundeswehr und sonstige Forschungseinrichtungen im Verteidigungsressort,28049146.33,Leistungen Dritter für Aufträge an die Universitäten der Bundeswehr und sonstige Forschungseinrichtungen im Verteidigungsressort,27766122.15
3523,129021413,Einnahmen der Universitäten der Bundeswehr aus Studiengebühren von externen Studierenden sowie aus sonstigen Dienstleistungen für Dritte,791136.0,Einnahmen der Universitäten der Bundeswehr aus Studienentgelten von externen Studierenden sowie aus sonstigen Dienstleistungen für Dritte,569557.43
3524,281011413,Erstattungen Dritter für die Gestellung von Personal der Bundeswehr,4051273.09,Erstattungen Dritter für die Gestellung von Personal der Bundeswehr,1702159.62
3525,381011413,Leistungen von Bundesbehörden zur Durchführung von Aufträgen,28129368.21,Leistungen von Bundesbehörden zur Durchführung von Aufträgen,26369702.03
3526,381031413,Verrechnungseinnahmen gemäß § 61 BHO außerhalb der Tit. 381 .1 und 381 .7,910440.01,Verrechnungseinnahmen gemäß § 61 BHO außerhalb der Tit. 381 .1 und 381 .7,719761.19
3527,382011413,Einnahmen aus der Durchführung sonstiger Veranstaltungen,1591.98,Einnahmen aus der Durchführung sonstiger Veranstaltungen,5778.0
3528,531011413,Beratungsleistungen zur Optimierung der Bundeswehr,483340.72,Beratungsleistungen zur Optimierung der Bundeswehr,4483178.9
3529,532011413,Aufträge und Dienstleistungen im Bereich Informationstechnik,1627952000.0,Aufträge und Dienstleistungen im Bereich Informationstechnik,1230795886.8
3530,532041413,Beratungs- und Unterstützungsleistungen der BwConsulting GmbH,27995572.6,Beratungs- und Unterstützungsleistungen der BwConsulting GmbH,27400000.0
3531,671021413,Erstattungen an Religionsgemeinschaften,1544131.77,Erstattungen an Religionsgemeinschaften,1270702.23
3532,681011413,Unterstützungen und sonstige Geldleistungen,392330.32,Unterstützungen und sonstige Geldleistungen,327149.27
3533,687011413,"Betrieb von deutschen Grund-/Haupt-/Realschulen, deutschen Abteilungen an internationalen Schulen und deutschen Kindergärten im Ausland",1281857.61,"Betrieb von deutschen Grund-/Haupt-/Realschulen, deutschen Abteilungen an internationalen Schulen und deutschen Kindergärten im Ausland",1244386.28
3534,697011413,Ausgaben im Zusammenhang mit dem Beteiligungserwerb und der -verwaltung an der Hensoldt AG,7499568.7,Ausgaben im Zusammenhang mit dem Beteiligungserwerb und der -verwaltung an der Hensoldt AG,395451.97
3535,982011413,Durchführung sonstiger Veranstaltungen sowie Betreuungsmaßnahmen aus diesbezüglichen Überschüssen,1591.98,Betreuungsmaßnahmen aus Überschüssen aus der Durchführung sonstiger Veranstaltungen,5778.0
3536,422011413,Bezüge und Nebenleistungen der planmäßigen Beamtinnen und Beamten,1549255391.98,Bezüge und Nebenleistungen der planmäßigen Beamtinnen und Beamten,1372656626.58
3537,422021413,Bezüge und Nebenleistungen der beamteten Hilfskräfte,3330130.98,Bezüge und Nebenleistungen der beamteten Hilfskräfte,4159391.58
3538,422031413,Bezüge der Anwärterinnen und Anwärter sowie Nebenleistungen der Beamtinnen und Beamten auf Widerruf im Vorbereitungsdienst,45737664.42,Bezüge der Anwärterinnen und Anwärter sowie Nebenleistungen der Beamtinnen und Beamten auf Widerruf im Vorbereitungsdienst,46450980.93
3539,427091413,"Entgelte für Arbeitskräfte mit befristeten Verträgen, sonstige Beschäftigungsentgelte (auch für Auszubildende) sowie Aufwendungen für nebenberuflich und nebenamtlich Tätige",108388816.53,"Entgelte für Arbeitskräfte mit befristeten Verträgen, sonstige Beschäftigungsentgelte (auch für Auszubildende) sowie Aufwendungen für nebenberuflich und nebenamtlich Tätige",113594976.51
3540,428011413,Entgelte der Arbeitnehmerinnen und Arbeitnehmer,2354934802.39,Entgelte der Arbeitnehmerinnen und Arbeitnehmer,2337985768.86
3541,452011413,Erstattung an die Versorgungsanstalt des Bundes und der Länder (VBL) einschließlich Verwaltungskostenzuschlag,6314225.21,Erstattung an die Versorgungsanstalt des Bundes und der Länder (VBL) einschließlich Verwaltungskostenzuschlag,7123592.35
3542,453011413,"Trennungsgeld, Fahrtkostenzuschüsse sowie Umzugskostenvergütungen",95042892.69,"Trennungsgeld, Fahrtkostenzuschüsse sowie Umzugskostenvergütungen",81407942.41
3543,511011413,"Geschäftsbedarf und Kommunikation sowie Geräte, Ausstattungs- und Ausrüstungsgegenstände, sonstige Gebrauchsgegenstände, Software, Wartung",34949184.47,"Geschäftsbedarf und Kommunikation sowie Geräte, Ausstattungs- und Ausrüstungsgegenstände, sonstige Gebrauchsgegenstände, Software, Wartung",34772682.18
3544,514011413,"Verbrauchsmittel, Haltung von Fahrzeugen und dgl.",6655704.94,"Verbrauchsmittel, Haltung von Fahrzeugen und dgl.",4614956.19
3545,518011413,Mieten und Pachten,2629518.22,Mieten und Pachten,888707.65
3546,525011413,Aus- und Fortbildung,22484184.02,Aus- und Fortbildung,16519533.05
3547,527011413,Dienstreisen,28937870.26,Dienstreisen,12288606.86
3548,531021413,"Seelsorgerische Dienste (Gottesdienste, Rüstzeiten, Exerzitien u. Ä.) und Kultkosten sowie Lebenskundlicher Unterricht",1687619.1,"Seelsorgerische Dienste (Gottesdienste, Rüstzeiten, Exerzitien u. Ä.) und Kultkosten sowie Lebenskundlicher Unterricht",709898.28
3549,534011413,Betrieb der Anlagen zur Entsorgung von chemischen Kampfstoffen,35777000.0,Betrieb der Anlagen zur Entsorgung von chemischen Kampfstoffen,20590000.0
3550,539991413,Vermischte Verwaltungsausgaben,20240579.11,Vermischte Verwaltungsausgaben,18445116.32
3551,544011413,"Forschung, Untersuchungen und Ähnliches",134487419.4,"Forschung, Untersuchungen und Ähnliches",70881016.33
3552,811011413,Erwerb von Fahrzeugen,990126.01,Erwerb von Fahrzeugen,1400870.84
3553,812011413,"Erwerb von Geräten, Ausstattungs- und Ausrüstungsgegenständen für Verwaltungszwecke (ohne IT)",67988530.52,"Erwerb von Geräten, Ausstattungs- und Ausrüstungsgegenständen für Verwaltungszwecke (ohne IT)",72325936.34
3554,831021413,Erwerb von Beteiligungen an Gesellschaften,70893494.0,Erwerb von Beteiligungen an Gesellschaften,171272724.38
3555,427891413,"Entgelte für Arbeitskräfte mit befristeten Verträgen, sonstige Beschäftigungsentgelte (auch für Auszubildende) sowie Aufwendungen für nebenberuflich und nebenamtlich Tätige",35446409.0,"Entgelte für Arbeitskräfte mit befristeten Verträgen, sonstige Beschäftigungsentgelte (auch für Auszubildende) sowie Aufwendungen für nebenberuflich und nebenamtlich Tätige",35360890.67
3556,511811413,"Geschäftsbedarf und Kommunikation sowie Geräte, Ausstattungs- und Ausrüstungsgegenstände, sonstige Gebrauchsgegenstände, Software, Wartung",2023926.4,"Geschäftsbedarf und Kommunikation sowie Geräte, Ausstattungs- und Ausrüstungsgegenstände, sonstige Gebrauchsgegenstände, Software, Wartung",2072667.1
3557,547811413,Nicht aufteilbare sächliche Verwaltungsausgaben,15890477.68,Nicht aufteilbare sächliche Verwaltungsausgaben,10422846.34
3558,812811413,"Erwerb von Geräten, Ausstattungs- und Ausrüstungsgegenständen für Verwaltungszwecke (ohne IT)",997628.9,"Erwerb von Geräten, Ausstattungs- und Ausrüstungsgegenständen für Verwaltungszwecke (ohne IT)",1182465.7
